name,brand,lat,lng,address_text,township,city,country_code
Yaung Chi Oo Petrol Station,,18.5333,95.5111,"Tharrawaddy, Myanmar",Tharrawaddy,Tharrawaddy,MM
MPE Filling Station,MPE,20.78,97.044,Bogyoke Road,Taunggyi,Taunggyi,MM
Shwe Taung Petrol Station,Shwe Taung,20.795,97.036,Near Taunggyi University,Taunggyi,Taunggyi,MM
CNPC Filling Station,CNPC,20.79,97.04,Main Road,Taunggyi,Taunggyi,MM
MPT Petrol Station,MPT,20.775,97.05,Somewhere in Taunggyi,Taunggyi,Taunggyi,MM
Sein Myittar Fuel Station,MPE,20.645,96.568,Kalaw-Aungban Road,Kalaw,Taunggyi,MM
U-Yee Filling Station,,20.635,96.555,Near Kalaw Market,Kalaw,Taunggyi,MM
Shwe Taung Ngwe Taung Petrol Station,Shwe Taung,20.64,96.56,Kalaw-Aungban Road,Kalaw,Taunggyi,MM
Aung Chan Thar Petrol Station,,20.655,96.575,Near Myin Ma Hti Cave Road,Kalaw,Taunggyi,MM
MPE Filling Station,MPE,20.655,96.925,"Main Road, Nyaungshwe",Nyaungshwe,Taunggyi,MM
Shwe Taung Filling Station,Shwe Taung,20.645,96.92,Near Nyaungshwe Market,Nyaungshwe,Taunggyi,MM
PTT Filling Station,PTT,20.66,96.93,Nyaungshwe-Taunggyi Road,Nyaungshwe,Taunggyi,MM
CNPC Filling Station,CNPC,20.63,96.915,Nyaungshwe Bypass,Nyaungshwe,Taunggyi,MM
Shwe Than Lwin Petrol Station,Shwe Than Lwin,20.791,97.073,Taunggyi-Hopong Road,Hopong,Taunggyi,MM
Hopong Filling Station,,20.796,97.075,Main Road,Hopong,Taunggyi,MM
Yadanar Theingi Filling Station,,20.415,97.305,Lawksawk-Taunggyi Road,Lawksawk,Taunggyi,MM
Shwe Padauk Oil Station,,20.418,97.296,Lawksawk-Taunggyi Road,Lawksawk,Taunggyi,MM
Myoma Fuel Station,Unknown,20.7833,97.0333,Taunggyi,Taunggyi,Taunggyi,MM
Pin Lone Fuel Station,Pin Lone,20.789,97.042,"Near Pin Lone Village, Taunggyi",Taunggyi,Taunggyi,MM
Kyaukse Fuel Station,Kyaukse,20.795,97.051,"Kyaukse Area, Taunggyi",Taunggyi,Taunggyi,MM
Thar Si Fuel Station,Thar Si,20.778,97.025,"Near Thar Si Village, Taunggyi",Taunggyi,Taunggyi,MM
Yae Aye Fuel Station,Yae Aye,20.765,97.018,"Yae Aye Area, Taunggyi",Taunggyi,Taunggyi,MM
Inn Lay Fuel Station,Inn Lay,20.752,97.005,"Near Inn Lay Lake, Taunggyi",Taunggyi,Taunggyi,MM
Nan Pan Fuel Station,Nan Pan,20.749,96.992,"Nan Pan Area, Taunggyi",Taunggyi,Taunggyi,MM
Shwe Nann Fuel Station,Shwe Nann,20.736,96.985,"Near Shwe Nann Village, Taunggyi",Taunggyi,Taunggyi,MM
Maha Myat Muni Fuel Station,Unknown,20.799,97.066,"Near Maha Myat Muni Pagoda, Taunggyi",Taunggyi,Taunggyi,MM
Taw Win Fuel Station,Unknown,20.805,97.072,"Taw Win Area, Taunggyi",Taunggyi,Taunggyi,MM
Nang Cho Fuel Station,Unknown,20.7855,97.0456,Taunggyi,Taunggyi,Taunggyi,MM
Aye Thar Yar Fuel Station,Unknown,20.7923,97.0389,"Aye Thar Yar, Taunggyi",Taunggyi,Taunggyi,MM
Shan Yoma Fuel Station,Shan Yoma,20.7798,97.0295,Taunggyi,Taunggyi,Taunggyi,MM
Inle Star Fuel Station,Inle Star,20.7682,97.0154,"Inle Region, Taunggyi",Taunggyi,Taunggyi,MM
Golden Land Fuel Station,Golden Land,20.7547,97.0012,Taunggyi,Taunggyi,Taunggyi,MM
Shwe Pyi Tan Fuel Station,Unknown,20.7815,97.0412,Taunggyi,Taunggyi,Taunggyi,MM
Pa-O Region Fuel Station,Pa-O,20.7942,97.0528,Taunggyi,Taunggyi,Taunggyi,MM
Taunggyi Main Fuel Station,Unknown,20.7759,97.0331,"Main Road, Taunggyi",Taunggyi,Taunggyi,MM
Nant Thar Gon Fuel Station,Unknown,20.7911,97.0607,Taunggyi,Taunggyi,Taunggyi,MM
Shwe Zabu Fuel Station,,20.78,97.03,Near Taunggyi University,Taunggyi,Taunggyi,MM
Pinmya Fuel Station,,20.77,97.04,Pinmya Village,Taunggyi,Taunggyi,MM
Aung Myin Thu Fuel Station,,20.79,97.02,Near Taunggyi General Hospital,Taunggyi,Taunggyi,MM
Kalaw Fuel Station,,22.66,96.56,Kalaw-Aungban Road,Kalaw,Taunggyi,MM
Aung Mingalar Fuel Station,,22.65,96.55,Near Kalaw Market,Kalaw,Taunggyi,MM
Pyae Sone Filling Station,,22.67,96.57,Near Kalaw Railway Station,Kalaw,Taunggyi,MM
Shwe Hnin Si Fuel Station,,22.65,96.56,Beside Main Road,Kalaw,Taunggyi,MM
Shwe Inn Gyinn Fuel Station,,20.64,96.92,Nyaungshwe-Taunggyi Road,Nyaungshwe,Taunggyi,MM
Yadanar Mann Fuel Station,,20.66,96.93,Nyaungshwe-Taunggyi Road,Nyaungshwe,Taunggyi,MM
Kyauk Taing Fuel Station,,20.61,96.91,Nyaungshwe-Taunggyi Road,Nyaungshwe,Taunggyi,MM
Shwe Sin Petrol Station,Shwe Sin,20.75,97.05,Hopong-Taunggyi Road,Hopong,Taunggyi,MM
Pa-O National Filling Station,,20.73,97.03,Near Hopong Market,Hopong,Taunggyi,MM
Myint Mo Fuel Station,,20.74,97.04,"Main Road, Hopong",Hopong,Taunggyi,MM
Lawksawk Fuel Station,,20.69,97.13,"Main Road, Lawksawk",Lawksawk,Taunggyi,MM
Shwe Lawksawk Petrol Station,Shwe Taung,20.7,97.12,Near Lawksawk Market,Lawksawk,Taunggyi,MM
Myo Ma (Pekon),,20.6667,96.8333,,Pekon,Taunggyi,MM
Pekon Filling Station,,20.6667,96.8333,,Pekon,Taunggyi,MM
Pinlaung Main Fuel Station,,20.48,96.86,Pinlaung,Pinlaung,Taunggyi,MM
Shwe Pinlaung Petrol Station,,20.49,96.87,Pinlaung,Pinlaung,Taunggyi,MM
Ywangan Fuel Station,,21.25,96.58,"Main Road, Ywangan",Ywangan,Taunggyi,MM
Aung Mingalar Fuel Station,,21.26,96.57,"Near Ywangan Market, Ywangan",Ywangan,Taunggyi,MM
Shwe Hintha Fuel Station,,21.24,96.59,"Ywangan-Pindaya Road, Ywangan",Ywangan,Taunggyi,MM
MPE Filling Station (Pathein),MPE,16.77,94.73,"Strand Road, Pathein",Pathein,Pathein,MM
Shwe Taung Filling Station (Pathein),Shwe Taung,16.78,94.73,"Aung Chan Thar Road, Pathein",Pathein,Pathein,MM
Unknown Filling Station (Pathein),,16.78,94.75,"Near Pathein University, Pathein",Pathein,Pathein,MM
Aung Myint Mo Filling Station,MPE,17.8011,95.0557,Thabaung-Ngaung Tone Road,Thabaung,Pathein,MM
Yadanar Theingi Filling Station,Shwe Taung,17.7989,95.0608,Thabaung-Ngaung Tone Road,Thabaung,Pathein,MM
Unknown Fuel Station,,17.73,94.68,Ngapudaw - Pathein Rd,Ngapudaw,Pathein,MM
Unknown Fuel Station,,17.71,94.75,Near Ngapudaw,Ngapudaw,Pathein,MM
Kangyidaunt Aung Gabar Petrol Station,MPE,16.737,94.944,Pathein - Myaungmya Rd,Kangyidaunt,Pathein,MM
Filling Station,,16.764,94.94,,Kangyidaunt,Pathein,MM
Shwe Padauk Petrol Station,,16.744,94.943,Pathein - Myaungmya Rd,Kangyidaunt,Pathein,MM
Shwe Pyi Nan Filling Station,Unknown,16.783,94.739,"Near Pathein University, Pathein",Pathein,Pathein,MM
Tun Filling Station,Tun,16.788,94.725,"Strand Road, Pathein",Pathein,Pathein,MM
Aung Thapyay Filling Station,Unknown,16.775,94.742,"Kyaung Street, Pathein",Pathein,Pathein,MM
New Light Filling Station,Unknown,16.792,94.718,"Near Bridge, Pathein",Pathein,Pathein,MM
Golden Star Filling Station,Unknown,16.768,94.751,"Industrial Zone, Pathein",Pathein,Pathein,MM
Myint Mo Filling Station,Unknown,16.771,94.733,"Corner of Main Street, Pathein",Pathein,Pathein,MM
Shwe Hintha Filling Station,Unknown,16.801,94.729,"Near Airport Road, Pathein",Pathein,Pathein,MM
Yuzana Filling Station,Unknown,16.785,94.755,"Beside Highway, Pathein",Pathein,Pathein,MM
Lin Thar Filling Station,Unknown,16.795,94.748,"West of Market, Pathein",Pathein,Pathein,MM
Pahtama Filling Station,Unknown,16.779,94.721,"City Center, Pathein",Pathein,Pathein,MM
Htoo Wai Yan Filling Station,Unknown,16.765,94.735,"Near the River, Pathein",Pathein,Pathein,MM
Zin Yaw Filling Station,Unknown,16.782,94.715,"North of town, Pathein",Pathein,Pathein,MM
Aye Chan Thar Filling Station,Unknown,16.798,94.761,"East of Pathein, Pathein",Pathein,Pathein,MM
Win Gabar Filling Station,Unknown,16.772,94.747,"Near School, Pathein",Pathein,Pathein,MM
Sein Gabar Filling Station,Unknown,16.789,94.732,"Opposite the Park, Pathein",Pathein,Pathein,MM
Ya Za Htar Filling Station,Unknown,16.762,94.728,"Southern part of the city, Pathein",Pathein,Pathein,MM
Pan Kyo Gabar Filling Station,Unknown,16.805,94.735,"Close to the market area, Pathein",Pathein,Pathein,MM
Shwe Lamin Filling Station,Unknown,16.777,94.711,"Near main road, Pathein",Pathein,Pathein,MM
Ko Htoo Aung Filling Station,Unknown,16.791,94.758,"Towards the outskirts, Pathein",Pathein,Pathein,MM
Ngar Gabar Filling Station,Unknown,16.769,94.744,"Beside Township Office, Pathein",Pathein,Pathein,MM
Shwe Nagar Filling Station,Unknown,16.786,94.708,"Outer ring road, Pathein",Pathein,Pathein,MM
Mya Gabar Filling Station,Unknown,16.793,94.719,"Beside the Main Market, Pathein",Pathein,Pathein,MM
Shwe Taung Petrol Station,Shwe Taung,17.647,95.468,Strand Road,Hinthada,Hinthada,MM
MPE Filling Station,MPE,17.642,95.463,Aung San Road,Hinthada,Hinthada,MM
PTT Petrol Station,PTT,17.638,95.459,Near Hinthada University,Hinthada,Hinthada,MM
CNPC Filling Station,CNPC,17.64,95.465,Bayint Naung Road,Hinthada,Hinthada,MM
Aung Yadana Petrol Station,Unknown,18.4321,95.4678,"Hinthada-Pathein Road, Hinthada",Hinthada,Hinthada,MM
Yoma Petrol Station,Yoma,18.4255,95.459,"Near Railway Station, Hinthada",Hinthada,Hinthada,MM
Myanmar Energy Petrol Station,Myanmar Energy,18.4392,95.4715,"Upper Main Road, Hinthada",Hinthada,Hinthada,MM
Pinlone Petrol Station,Pinlone,18.4188,95.4522,"Near the river, Hinthada",Hinthada,Hinthada,MM
Thanlwin Petrol Station,Unknown,18.4455,95.4789,"Beside Thanlwin River, Hinthada",Hinthada,Hinthada,MM
Shwe Pyi Tan Petrol Station,Unknown,18.4365,95.4691,"Near the market, Hinthada",Hinthada,Hinthada,MM
Myoma Petrol Station,Unknown,18.4298,95.4634,"Myoma area, Hinthada",Hinthada,Hinthada,MM
Ayeyarwady Petrol Station,Unknown,18.4511,95.4826,"Ayeyarwady River area, Hinthada",Hinthada,Hinthada,MM
Parami Petrol Station,Unknown,18.4222,95.4558,"Parami Street, Hinthada",Hinthada,Hinthada,MM
Shwe Sin Petrol Station,Unknown,18.4488,95.4802,"Close to Shwe Sin Pagoda, Hinthada",Hinthada,Hinthada,MM
Kyauk Tan Petrol Station,Unknown,18.4165,95.4501,"Kyauk Tan area, Hinthada",Hinthada,Hinthada,MM
Thazin Petrol Station,Unknown,18.4342,95.4655,"Thazin Street, Hinthada",Hinthada,Hinthada,MM
Kantaryar Petrol Station,Unknown,18.4418,95.4741,"Kantaryar area, Hinthada",Hinthada,Hinthada,MM
Bawgatiri Petrol Station,Unknown,18.4139,95.4478,"Bawgatiri Area, Hinthada",Hinthada,Hinthada,MM
Yuzana Petrol Station,Yuzana,18.4271,95.4607,"Yuzana Street, Hinthada",Hinthada,Hinthada,MM
Golden Land Petrol Station,Golden Land,18.4431,95.4754,"Golden Land Area, Hinthada",Hinthada,Hinthada,MM
Shwe Hintha Petrol Station,Unknown,18.4305,95.4641,"Shwe Hintha Street, Hinthada",Hinthada,Hinthada,MM
United Petrol Station,United,18.4195,95.4539,"Near the stadium, Hinthada",Hinthada,Hinthada,MM
Pioneer Petrol Station,Unknown,18.4462,95.4795,On the outskirts of Hinthada,Hinthada,Hinthada,MM
Myat Phone Petrol Station,Unknown,18.4238,95.4574,"Close to the city center, Hinthada",Hinthada,Hinthada,MM
Zaw Gyi Petrol Station,Unknown,18.4378,95.4701,"Zaw Gyi Ward, Hinthada",Hinthada,Hinthada,MM
MPE Filling Station,MPE,18.812,95.228,Bago-Pyay Road,Pyay,Pyay,MM
Shwe Taung Filling Station,Shwe Taung,18.82,95.235,Bago-Pyay Road,Pyay,Pyay,MM
PTT Filling Station,PTT,18.818,95.24,Bago-Pyay Road,Pyay,Pyay,MM
CNPC Filling Station,CNPC,18.805,95.245,Bago-Pyay Road,Pyay,Pyay,MM
Total Filling Station,Total,18.808,95.231,Bago-Pyay Road,Pyay,Pyay,MM
Aung Myint Mo Filling Station,,18.825,95.22,Near Pyay University,Pyay,Pyay,MM
Myint Mo Filling Station,,18.815,95.215,Near Pyay Railway Station,Pyay,Pyay,MM
Kyaw Zeya Filling Station,,18.83,95.23,Tharsi Road,Pyay,Pyay,MM
MPE Filling Station,MPE,18.857,95.355,Pyay-Aunglan Road,Paukkung,Pyay,MM
Shwe Taung Filling Station,Shwe Taung,18.862,95.36,Pyay-Aunglan Road,Paukkung,Pyay,MM
Shwe Taung Petrol Station,Shwe Taung,18.749,95.334,Yangon-Pyay Road,Shwedaung,Pyay,MM
MPE Filling Station,MPE,18.755,95.341,Near Shwedaung Hospital,Shwedaung,Pyay,MM
Aung Thitsar Filling Station,MPE,18.673,95.391,Yangon-Pyay Rd,Pandaung,Pyay,MM
Kyaw Zaya Filling Station,MPE,18.694,95.365,Yangon-Pyay Rd,Pandaung,Pyay,MM
Yadanar Theingi Filling Station,Unknown,18.8281,95.2245,"Pyay, Myanmar",Pyay,Pyay,MM
Parami Filling Station,Unknown,18.8203,95.2317,"Pyay, Myanmar",Pyay,Pyay,MM
Aung Gabar Filling Station,Unknown,18.8359,95.2192,"Pyay, Myanmar",Pyay,Pyay,MM
Min Tayza Filling Station,Unknown,18.8127,95.2389,"Pyay, Myanmar",Pyay,Pyay,MM
Shwe Pyi Tan Filling Station,Unknown,18.8435,95.2126,"Pyay, Myanmar",Pyay,Pyay,MM
Mya Yadanar Filling Station,Unknown,18.8051,95.2463,"Pyay, Myanmar",Pyay,Pyay,MM
Pinlon Filling Station,Unknown,18.7975,95.2531,"Pyay, Myanmar",Pyay,Pyay,MM
Than Win Filling Station,Unknown,18.7949,95.2398,"Pyay, Myanmar",Pyay,Pyay,MM
Shwe Hintha Filling Station,Unknown,18.8174,95.2264,"Pyay, Myanmar",Pyay,Pyay,MM
New Light Filling Station,Unknown,18.8308,95.2228,"Pyay, Myanmar",Pyay,Pyay,MM
Kyaw Thadar Filling Station,Unknown,18.8386,95.2157,"Pyay, Myanmar",Pyay,Pyay,MM
Phyu Sin Filling Station,Unknown,18.8255,95.2281,"Pyay, Myanmar",Pyay,Pyay,MM
Yoma Filling Station,Unknown,18.8102,95.2415,"Pyay, Myanmar",Pyay,Pyay,MM
Hinthar Gone Filling Station,Unknown,18.7823,95.2495,"Pyay, Myanmar",Pyay,Pyay,MM
Minlwin Filling Station,Unknown,18.7775,95.2449,"Pyay, Myanmar",Pyay,Pyay,MM
Moe Kaung Kin Filling Station,Unknown,18.7911,95.2567,"Pyay, Myanmar",Pyay,Pyay,MM
Aung Myint Mo Filling Station,MPE,16.709,94.704,Myaungmya-Einme Road,Myaungmya,Myaungmya,MM
Yadanar Maung Filling Station,Unknown,16.695,94.719,Myaungmya-Wakema Road,Myaungmya,Myaungmya,MM
Shwe Pyi Tan Filling Station,Unknown,16.702,94.707,Strand Road,Myaungmya,Myaungmya,MM
Einme YBS Filling Station,YBS,16.6809,94.9573,Einme-Myaungmya Rd,Einme,Myaungmya,MM
Shwe Padauk Petrol Station,Shwe Padauk,16.6823,94.9552,Einme-Myaungmya Rd,Einme,Myaungmya,MM
Wakema Filling Station,,16.733,94.933,Wakema,Wakema,Myaungmya,MM
Shwe Than Lwin Filling Station,,16.728,94.939,Wakema,Wakema,Myaungmya,MM
Myoma Filling Station,Unknown,16.703,94.897,"Myoma Road, Myaungmya",Myaungmya,Myaungmya,MM
Aung Gabar Filling Station,Unknown,16.708,94.902,"Aung Gabar Quarter, Myaungmya",Myaungmya,Myaungmya,MM
Shwe Hin Thar Filling Station,Unknown,16.695,94.89,"Near the river, Myaungmya",Myaungmya,Myaungmya,MM
Pyi Taw Aye Filling Station,Unknown,16.712,94.91,"Pyi Taw Aye ward, Myaungmya",Myaungmya,Myaungmya,MM
Min Tayar Filling Station,Unknown,16.698,94.885,"Min Tayar quarter, Myaungmya",Myaungmya,Myaungmya,MM
Thazin Filling Station,Unknown,16.715,94.915,"Thazin village, Myaungmya",Myaungmya,Myaungmya,MM
Aung Takon Filling Station,Unknown,16.705,94.9,"Aung Takon Quarter, Myaungmya",Myaungmya,Myaungmya,MM
Shwe Myaing Filling Station,Unknown,16.69,94.895,"Shwe Myaing village, Myaungmya",Myaungmya,Myaungmya,MM
Kant Kaw Filling Station,Unknown,16.718,94.92,"Kant Kaw Quarter, Myaungmya",Myaungmya,Myaungmya,MM
Nga Yoke Kaung Filling Station,Unknown,16.685,94.88,"Nga Yoke Kaung Quarter, Myaungmya",Myaungmya,Myaungmya,MM
May Yu Filling Station,Unknown,16.7,94.905,"May Yu Quarter, Myaungmya",Myaungmya,Myaungmya,MM
Bo Bo Aung Filling Station,Unknown,16.72,94.925,"Bo Bo Aung Quarter, Myaungmya",Myaungmya,Myaungmya,MM
Shwe Taung Filling Station,Unknown,16.678,94.875,"Shwe Taung village, Myaungmya",Myaungmya,Myaungmya,MM
MPE Filling Station (Pyapon),MPE,16.27,95.69,Pyapon-Bogale Road,Pyapon,Pyapon,MM
Shwe Taung Filling Station (Pyapon),Shwe Taung,16.28,95.68,Pyapon-Bogale Road,Pyapon,Pyapon,MM
PTT Filling Station (Pyapon),PTT,16.29,95.67,"Strand Road, Pyapon",Pyapon,Pyapon,MM
Aung Yadana Petrol Station,MPE,16.337,95.688,Kyaunggon-Pyapon Road,Kyaunggon,Pyapon,MM
Hein Petrol Station,Unknown,16.332,95.692,Kyaunggon-Pyapon Road,Kyaunggon,Pyapon,MM
Shwe Byain Phyu Filling Station,Shwe Byain Phyu,16.325,95.561,Dedaye-Bogale Road,Dedaye,Pyapon,MM
MPE Filling Station,MPE,16.319,95.559,Dedaye-Bogale Road,Dedaye,Pyapon,MM
MPT Filling Station,MPT,16.308,95.542,Unknown,Dedaye,Pyapon,MM
Aung Gabar Filling Station,MPE,16.275,95.264,Bogale-Mawlamyinegyun Road,Bogale,Pyapon,MM
Myat Gabar Filling Station,MPE,16.28,95.266,Bogale-Mawlamyinegyun Road,Bogale,Pyapon,MM
Win Star Filling Station,Win Star,16.2833,95.6833,"Pyapon, Myanmar",Pyapon,Pyapon,MM
Yuzana Filling Station,Yuzana,16.275,95.67,"Near Pyapon University, Pyapon",Pyapon,Pyapon,MM
Shwe Padauk Filling Station,Shwe Padauk,16.268,95.665,"Along Main Road, Pyapon",Pyapon,Pyapon,MM
Global Energy Filling Station,Global Energy,16.2883,95.6933,"Pyapon, near the bridge",Pyapon,Pyapon,MM
Myat Mingalar Filling Station,Myat Mingalar,16.27,95.675,Pyapon Township,Pyapon,Pyapon,MM
Aung Thitsar Filling Station,Aung Thitsar,16.265,95.66,"Close to the market, Pyapon",Pyapon,Pyapon,MM
Shwe Nant Thar Filling Station,Shwe Nant Thar,16.28,95.68,On the outskirts of Pyapon,Pyapon,Pyapon,MM
U & Me Filling Station,U & Me,16.29,95.695,"Along the river road, Pyapon",Pyapon,Pyapon,MM
Tun Filling Station,Tun,16.278,95.673,"Near the city center, Pyapon",Pyapon,Pyapon,MM
Golden Star Filling Station,Golden Star,16.263,95.658,Pyapon Industrial Zone,Pyapon,Pyapon,MM
Forever Filling Station,Forever,16.285,95.688,"Pyapon, near the school",Pyapon,Pyapon,MM
Shwe Hin Thar Filling Station,Shwe Hin Thar,16.273,95.678,Pyapon Main Road,Pyapon,Pyapon,MM
MPE Maubin Branch,MPE,16.735,95.705,Corner of Strand Road and Bo Aung Kyaw Road,Maubin,Maubin,MM
Shwe Taung Gas Station,Shwe Taung,16.74,95.715,"Strand Road, near the market",Maubin,Maubin,MM
MPE Nyaungdon,MPE,16.625,95.705,Yangon-Pathein Road,Nyaungdon,Maubin,MM
Shwe Taung Nyaungdon,Shwe Taung,16.615,95.71,Yangon-Pathein Road,Nyaungdon,Maubin,MM
Aung Myint Mo Petrol Station,MPE,16.6808,95.4387,Near Pantanaw Hospital,Pantanaw,Maubin,MM
Unknown Petrol Station,,16.6712,95.4366,Pantanaw-Maubin Road,Pantanaw,Maubin,MM
Myoma Gas Station,MPE,16.703,95.482,Myoma Road,Danyingon,Maubin,MM
Danyingon Highway Gas Station,Shwe Taung,16.695,95.478,Yangon-Pathein Highway,Danyingon,Maubin,MM
Yoma Gas Station,MPT,16.7,95.485,Near Danyingon Market,Danyingon,Maubin,MM
Zaw Zaw Win Petrol Station,Unknown,16.7377,95.7564,Maubin-Nyaungdon Road,Maubin,Maubin,MM
Tun Family Fuel Station,Unknown,16.7412,95.7618,Maubin Township,Maubin,Maubin,MM
Golden Star Petrol Station,Unknown,16.7345,95.7592,Maubin,Maubin,Maubin,MM
Shwe Pyi Tan Petrol,Unknown,16.7398,95.7589,Maubin,Maubin,Maubin,MM
Min Thar Gyi Station,Unknown,16.7445,95.7632,Maubin,Maubin,Maubin,MM
Phyo Pa Pa Petrol Station,Unknown,16.7423,95.7601,Maubin,Maubin,Maubin,MM
Aye Yarwady Fuel Station,Unknown,16.7369,95.7555,Maubin Township,Maubin,Maubin,MM
Zawana Petrol,Unknown,16.7385,95.7575,Maubin,Maubin,Maubin,MM
Yadanar Theingi Station,Unknown,16.7405,95.7599,Maubin,Maubin,Maubin,MM
Myoma Fuel Station,MPE,16.45,94.75,Myoma Road,Labutta,Labutta,MM
Shwe Pyi Tan Fuel Station,Shwe Taung,16.46,94.74,Strand Road,Labutta,Labutta,MM
Yadanarbon Fuel Station,,16.44,94.76,Aung Mingalar Quarter,Labutta,Labutta,MM
Mawlamyinegyun Filling Station,MPE,16.268,94.842,Mawlamyinegyun-Labutta Road,Mawlamyinegyun,Labutta,MM
Shwe Taung Filling Station,Shwe Taung,16.255,94.851,Mawlamyinegyun-Labutta Road,Mawlamyinegyun,Labutta,MM
Unknown Fuel Station,,15.964,94.735,Pyinsalu,Pyinsalu,Labutta,MM
MPE Fuel Station,MPE,15.967,94.738,Near Pyinsalu Market,Pyinsalu,Labutta,MM
Aung Gabar Fuel Station,Unknown,16.4456,94.7211,Labutta Township,Labutta,Labutta,MM
Win Gabar Fuel Station,Unknown,16.4412,94.7189,"Near Labutta Hospital, Labutta Township",Labutta,Labutta,MM
Shwe Hintha Fuel Station,Unknown,16.4387,94.7245,"Bayint Naung Road, Labutta Township",Labutta,Labutta,MM
Parami Fuel Station,Unknown,16.4488,94.7192,"Near the Market, Labutta Township",Labutta,Labutta,MM
Shwe Padauk Fuel Station,Unknown,16.4501,94.7233,"Main Road, Labutta Township",Labutta,Labutta,MM
Aye Yarwaddy Fuel Station,Unknown,16.4355,94.7166,"Near the river, Labutta Township",Labutta,Labutta,MM
Mya Padauk Fuel Station,Unknown,16.4422,94.7255,Labutta Township,Labutta,Labutta,MM
Shwe Nanttha Fuel Station,Unknown,16.4477,94.72,"Near the clock tower, Labutta Township",Labutta,Labutta,MM
Golden Land Fuel Station,Unknown,16.4395,94.7265,Labutta Township,Labutta,Labutta,MM
Bogale Filling Station,MPE,16.18,95.28,Bogale Road,Bogale,Bogale,MM
Shwe Taung Petrol Station,Shwe Taung,16.19,95.27,Main Road,Bogale,Bogale,MM
Aung Myin Thu Petrol Station,Unknown,16.464,95.538,Kyaiklat-Bogale Road,Kyaiklat,Bogale,MM
Zaw Win Htike Petrol Station,Unknown,16.459,95.535,Kyaiklat-Bogale Road,Kyaiklat,Bogale,MM
Shwe Pyi Thar Petrol Station,Unknown,16.461,95.537,Kyaiklat-Bogale Road,Kyaiklat,Bogale,MM
Myint Mo Petrol Station,Unknown,16.275,95.378,Bogale,Bogale,Bogale,MM
Nga Yoke Kaung Petrol Station,Unknown,16.282,95.372,Bogale,Bogale,Bogale,MM
Kyaw Lin Aung Petrol,Unknown,16.289,95.365,Bogale,Bogale,Bogale,MM
Aye Yarwady Petrol Station,Unknown,16.278,95.385,Bogale,Bogale,Bogale,MM
Shwe Hintha Petrol,Unknown,16.295,95.37,Bogale,Bogale,Bogale,MM
Yadanar Theingi Fuel Station,Unknown,16.285,95.38,Bogale,Bogale,Bogale,MM
New Light Petrol Station,Unknown,16.292,95.375,Bogale,Bogale,Bogale,MM
Golden Land Fuel Stop,Unknown,16.27,95.37,Bogale,Bogale,Bogale,MM
Min Tain Petrol Pump,Unknown,16.28,95.36,Bogale,Bogale,Bogale,MM
Paing Htoo Filling Station,Unknown,16.29,95.385,Bogale,Bogale,Bogale,MM
Thiri Mingalar Fuel,Unknown,16.265,95.375,Bogale,Bogale,Bogale,MM
Shwe Taung Fuel Station (Twante),Shwe Taung,16.715,95.954,Yangon-Twante Rd,Twante,Twante,MM
MPE Fuel Station (Twante),MPE,16.711,95.959,Yangon-Twante Rd,Twante,Twante,MM
PTT Filling Station (Twante),PTT,16.699,95.948,Near Twante Canal,Twante,Twante,MM
CNPC Fuel Station (Twante),CNPC,16.705,95.952,Yangon-Twante Rd,Twante,Twante,MM
MPE Filling Station (Kungyangon),MPE,16.607,95.994,Yangon-Kungyangon Road,Kungyangon,Twante,MM
Shwe Taung Filling Station (Kungyangon),Shwe Taung,16.593,95.985,Yangon-Kungyangon Road,Kungyangon,Twante,MM
PTT Filling Station (Kungyangon),PTT,16.614,95.998,Yangon-Kungyangon Road,Kungyangon,Twante,MM
Aung Yadana Fuel Station,Unknown,16.7345,96.0678,"Twante-Maubin Road, Twante",Twante,Twante,MM
Aye Chan Thar Fuel Station,Unknown,16.7289,96.0721,"Near Twante Canal, Twante",Twante,Twante,MM
Bo Bo Aung Fuel Station,Unknown,16.7412,96.0598,"Twante-Maubin Road, Twante",Twante,Twante,MM
Htoo Aung Fuel Station,Unknown,16.7198,96.0812,"Twante-Dala Road, Twante",Twante,Twante,MM
Kaung Set Thitsar Fuel Station,Unknown,16.7385,96.0634,"Twante, Near Market",Twante,Twante,MM
Myat Mandalar Fuel Station,Unknown,16.7256,96.0754,"Twante, Main Road",Twante,Twante,MM
New Light Fuel Station,Unknown,16.7311,96.0697,"Twante, Near the bridge",Twante,Twante,MM
Phyo Pa Pa Win Fuel Station,Unknown,16.7223,96.0789,"Twante Township, Main Street",Twante,Twante,MM
Shwe Pyi Tan Fuel Station,Unknown,16.7458,96.0556,"Twante, Near the river",Twante,Twante,MM
Thiri Yadanar Fuel Station,Unknown,16.7368,96.0655,"Twante, close to the center",Twante,Twante,MM
Yadanar Thike Fuel Station,Unknown,16.7295,96.0715,"Twante, on the main road",Twante,Twante,MM
Zawana Fuel Station,Unknown,16.7432,96.0582,"Twante-Maubin Highway, Twante",Twante,Twante,MM
Aung Myin Thu Petrol Station,MPE,17.523,94.746,Kyonpyaw-Pathein Road,Kyonpyaw,Kyonpyaw,MM
Min Thadar Fuel Station,,17.518,94.741,Kyonpyaw-Pathein Road,Kyonpyaw,Kyonpyaw,MM
Myat Thu Kha Petrol Station,,17.521,94.743,Kyonpyaw-Pathein Road,Kyonpyaw,Kyonpyaw,MM
Unknown Fuel Station,,17.653,94.924,Ingapu-Kyonpyaw Road,Ingapu,Kyonpyaw,MM
MPE Filling Station,MPE,17.65,94.921,Main Road,Ingapu,Kyonpyaw,MM
Shwe Than Lwin Fuel Station,Shwe Than Lwin,17.6453,94.7891,"Kyonpyaw, Ayeyarwady Region",Kyonpyaw,Kyonpyaw,MM
Yadanar Theingi Fuel Station,Yadanar Theingi,17.6512,94.7934,"Near Kyonpyaw Market, Kyonpyaw",Kyonpyaw,Kyonpyaw,MM
Aung Zeya Fuel Station,Aung Zeya,17.6488,94.7867,"Main Road, Kyonpyaw",Kyonpyaw,Kyonpyaw,MM
Myo Paing Fuel Station,Myo Paing,17.6395,94.7952,"Kyonpyaw Township, Ayeyarwady",Kyonpyaw,Kyonpyaw,MM
Htoo Paing Fuel Station,Htoo Paing,17.6556,94.7905,"Kyonpyaw, Ayeyarwady",Kyonpyaw,Kyonpyaw,MM
Zaw Gyi Fuel Station,Zaw Gyi,17.6422,94.7879,"Near the bus station, Kyonpyaw",Kyonpyaw,Kyonpyaw,MM
Aye Chan Thar Fuel Station,Aye Chan Thar,17.6499,94.7968,North of Kyonpyaw,Kyonpyaw,Kyonpyaw,MM
Mya Thandar Fuel Station,Mya Thandar,17.6378,94.7911,Kyonpyaw Main Road,Kyonpyaw,Kyonpyaw,MM
Ngar Maung Gyi Fuel Station,Ngar Maung Gyi,17.6533,94.7845,Close to Kyonpyaw hospital,Kyonpyaw,Kyonpyaw,MM
Shwe Pyi Tan Fuel Station,Shwe Pyi Tan,17.6411,94.7986,"Near the river, Kyonpyaw",Kyonpyaw,Kyonpyaw,MM
Thu Kha Yadana Fuel Station,Thu Kha Yadana,17.6466,94.7944,Kyonpyaw,Kyonpyaw,Kyonpyaw,MM
Aye Myint Zu Fuel Station,Aye Myint Zu,17.6355,94.7857,On the outskirts of Kyonpyaw,Kyonpyaw,Kyonpyaw,MM
Wakema Highway Fuel Station,MPE,16.8812,95.1745,Wakema-Myaungmya Road,Wakema,Wakema,MM
Shwe Taung Wakema Fuel Station,Shwe Taung,16.865,95.1762,Near Wakema Market,Wakema,Wakema,MM
Unknown Fuel Station,,16.73,95.02,Lemyethna-Wakema Road,Lemyethna,Wakema,MM
Aung Myint Mo Fuel Station,Unknown,16.7324,94.7851,Wakema,Wakema,Wakema,MM
Yadanar Maung Fuel Station,Unknown,16.7345,94.7872,Wakema,Wakema,Wakema,MM
Win Star Fuel Station,Unknown,16.7366,94.7893,Wakema,Wakema,Wakema,MM
Myoma Fuel Station,Unknown,16.7387,94.7914,Wakema,Wakema,Wakema,MM
Hlaing Thar Yar Fuel Station,Unknown,16.7408,94.7935,Wakema,Wakema,Wakema,MM
Shwe Pyi Tan Fuel Station,Unknown,16.7429,94.7956,Wakema,Wakema,Wakema,MM
Nawarat Fuel Station,Unknown,16.745,94.7977,Wakema,Wakema,Wakema,MM
Thiri Mingalar Fuel Station,Unknown,16.7471,94.7998,Wakema,Wakema,Wakema,MM
Myat Thazin Fuel Station,Unknown,16.7492,94.8019,Wakema,Wakema,Wakema,MM
Kyaw Zaya Fuel Station,Unknown,16.7513,94.804,Wakema,Wakema,Wakema,MM
Aye Yarwady Fuel Station,Unknown,16.7534,94.8061,Wakema,Wakema,Wakema,MM
Min Thandar Fuel Station,Unknown,16.7555,94.8082,Wakema,Wakema,Wakema,MM
Thet Htar Ni Fuel Station,Unknown,16.7576,94.8103,Wakema,Wakema,Wakema,MM
MPE Filling Station (Magway),MPE,20.14,94.93,Near Magway University,Magway,Magway,MM
Shwe Taung Filling Station (Magway),Shwe Taung,20.15,94.95,Yangon-Magway Road,Magway,Magway,MM
PTT Filling Station (Magway),PTT,20.13,94.92,Magway-Minbu Road,Magway,Magway,MM
CNPC Filling Station (Magway),CNPC,20.16,94.94,Beside Ayeyarwady River,Magway,Magway,MM
MPE Filling Station,MPE,20.46,94.86,Yenangyaung-Chauk Road,Yenangyaung,Magway,MM
Shwe Taung Filling Station,Shwe Taung,20.45,94.87,Near Yenangyaung University,Yenangyaung,Magway,MM
YBS Filling Station,,20.43,94.88,North of Yenangyaung,Yenangyaung,Magway,MM
Aung Myin Thar Filling Station,MPE,20.882,94.819,Yangon-Chauk Road,Chauk,Magway,MM
Shwe Padauk Phyu Filling Station,MPE,20.873,94.828,Yangon-Chauk Road,Chauk,Magway,MM
Win Kyae Filling Station,,20.876,94.832,Unknown,Chauk,Magway,MM
