name,brand,lat,lng,address_text,township,city,country_code
Aye Chan Thar Filling Station,Unknown,22.558,95.705,Shwebo Industrial Zone,Shwebo,Shwebo,MM
New Light Filling Station,Unknown,22.545,95.685,Near Shwebo Railway Station,Shwebo,Shwebo,MM
Golden Land Filling Station,Unknown,22.565,95.665,On the way to Kyauk Myaung,Shwebo,Shwebo,MM
Paing Htoo Filling Station,Unknown,22.551,95.715,Outskirt of Shwebo town,Shwebo,Shwebo,MM
Myat Mandalar Filling Station,Unknown,22.575,95.685,Corner of Main Road and Hospital Road,Shwebo,Shwebo,MM
Emerald Green Filling Station,Unknown,22.56,95.655,"West side of Shwebo, near the river",Shwebo,Shwebo,MM
Sein Lei Filling Station,Unknown,22.54,95.7,"South Shwebo, near the highway entrance",Shwebo,Shwebo,MM
Star Shine Filling Station,Unknown,22.58,95.71,"North Shwebo, near the village",Shwebo,Shwebo,MM
New Generation Filling Station,Unknown,22.55,95.66,"Western part of Shwebo, closer to the fields",Shwebo,Shwebo,MM
Pin Lone Filling Station,Unknown,22.57,95.675,"Near the monastery, Shwebo",Shwebo,Shwebo,MM
MPE Fuel Station,MPE,24.182,96.327,Katha-Indaw Road,Katha,Katha,MM
Shwe Taung Fuel Station,Shwe Taung,24.175,96.32,Near Katha Clock Tower,Katha,Katha,MM
Inn Daw Myoma Petrol Station,MPE,24.491,96.134,Myoma Road,Indaw,Katha,MM
Shwe Myanmar Filling Station,Shwe Taung,24.488,96.13,Near Indaw railway station,Indaw,Katha,MM
Tigyaing Fuel Station,MPE,24.23,96.46,"Main Road, Tigyaing",Tigyaing,Katha,MM
Shwe Taung Petrol,Shwe Taung,24.22,96.45,Near Tigyaing Market,Tigyaing,Katha,MM
CNPC Tigyaing,CNPC,24.24,96.47,Tigyaing-Katha Road,Tigyaing,Katha,MM
Banmauk Fuel Station,,24.3667,95.8333,Banmauk,Banmauk,Katha,MM
MPE Fuel Station,MPE,24.35,95.85,Near Banmauk Main Road,Banmauk,Katha,MM
Aung Myint Mo Fuel Station,Unknown,24.1768,96.3452,"Katha, Myanmar",Katha,Katha,MM
Myoma Fuel Station (Katha),Unknown,24.1745,96.3428,"Myoma Ward, Katha",Katha,Katha,MM
Shwe Pyi Tan Fuel Station,Unknown,24.1692,96.3385,"Katha - Indaw Road, Katha",Katha,Katha,MM
Zin Yaw Fuel Station,Unknown,24.2231,96.3714,"Katha Township, Near Railway Station",Katha,Katha,MM
Yadanar Kyaw Fuel Station,Unknown,24.1722,96.3401,"Katha, Near Hospital",Katha,Katha,MM
New Light Fuel Station,Unknown,24.1789,96.3467,"Katha, Main Road",Katha,Katha,MM
Kyaw Zaya Fuel Station,Unknown,24.1805,96.3481,"Katha, Central Area",Katha,Katha,MM
Shwe Nagar Fuel Station,Unknown,24.225,96.373,"Katha Township, Outskirts",Katha,Katha,MM
Min Thitsar Fuel Station,Unknown,24.1675,96.3367,"Katha, Near Market",Katha,Katha,MM
Aung Takon 2 Fuel Station,Unknown,24.1708,96.3393,"Katha, Near Park",Katha,Katha,MM
Golden Gate Fuel Station,Unknown,24.1821,96.3497,"Katha, Downtown Area",Katha,Katha,MM
Shwe Hintha Fuel Station,Unknown,24.2267,96.3747,"Katha Township, Rural Area",Katha,Katha,MM
Yadanarpon Fuel Station,Unknown,24.1659,96.3351,"Katha, Industrial Area",Katha,Katha,MM
Thitsar Kyaw Fuel Station,Unknown,24.1739,96.3416,"Katha, Residential Area",Katha,Katha,MM
Kyaw Myanmar Fuel Station,Unknown,24.1753,96.3435,"Katha, Close to the River",Katha,Katha,MM
Naung Cho Fuel Station,Unknown,24.2003,96.3652,"Naung Cho, Katha Township",Katha,Katha,MM
Unknown Fuel Station,,24.36,94.94,Kawlin-Wuntho Road,Kawlin,Kawlin,MM
MPE Fuel Station,MPE,24.36,94.94,Near Kawlin Town,Kawlin,Kawlin,MM
Unknown Fuel Station,,24.205,95.735,Wuntho-Kawlin Road (Likely),Wuntho,Kawlin,MM
MPE Fuel Station,MPE,24.208,95.738,Wuntho,Wuntho,Kawlin,MM
Pinlebu Fuel Station,,24.33,95.72,Pinlebu-Kawlin Road,Pinlebu,Kawlin,MM
MPT Fuel Station,MPT,24.32,95.71,Near Pinlebu Market,Pinlebu,Kawlin,MM
Shwe Thanlwin Fuel Station,Shwe Thanlwin,24.3112,95.1876,"Kawlin-Wuntho Road, Kawlin",Kawlin,Kawlin,MM
Aye Yarwady Fuel Station,Aye Yarwady,24.2985,95.1792,"Near Kawlin Market, Kawlin",Kawlin,Kawlin,MM
Global Energy Fuel Station,Global Energy,24.305,95.191,"On the outskirts of Kawlin, Kawlin",Kawlin,Kawlin,MM
Myoma Fuel Station,Myoma,24.3,95.1825,"Myoma Ward, Kawlin",Kawlin,Kawlin,MM
Yadanar Fuel Station,Yadanar,24.315,95.175,"North of Kawlin, Kawlin",Kawlin,Kawlin,MM
Aung Myint Mo Fuel Station,Aung Myint Mo,24.295,95.185,"South Kawlin, Kawlin",Kawlin,Kawlin,MM
Shwe Pyi Tan Fuel Station,Shwe Pyi Tan,24.3075,95.18,"Near the bus station, Kawlin",Kawlin,Kawlin,MM
Min Tayar Fuel Station,Min Tayar,24.31,95.195,"East of Kawlin, Kawlin",Kawlin,Kawlin,MM
Nilar Fuel Station,Nilar,24.29,95.17,"West of Kawlin, Kawlin",Kawlin,Kawlin,MM
Golden Star Fuel Station,Golden Star,24.3025,95.189,"Central Kawlin, Kawlin",Kawlin,Kawlin,MM
Shwe Hnin Si Fuel Station,Shwe Hnin Si,24.3125,95.1775,"Kawlin Main Road, Kawlin",Kawlin,Kawlin,MM
Kyaw Zaya Fuel Station,Kyaw Zaya,24.2975,95.181,"Near the river, Kawlin",Kawlin,Kawlin,MM
Than Lwin Oo Fuel Station,Than Lwin Oo,24.3015,95.1935,"Towards the village, Kawlin",Kawlin,Kawlin,MM
Zawana Fuel Station,Zawana,24.285,95.165,"Adjacent to the school, Kawlin",Kawlin,Kawlin,MM
MPE Fuel Station (Aung Mingalar),MPE,23.185,94.054,"Aung Mingalar Ward, Kalay-Tamu Road",Kalay,Kalay,MM
Shwe Taung Fuel Station,Shwe Taung,23.178,94.048,"Near Kalay University, Kalay-Tamu Road",Kalay,Kalay,MM
PTT Fuel Station (Kalay),PTT,23.192,94.057,"Myoma Ward, Kalay-Tamu Road",Kalay,Kalay,MM
MPE Fuel Station (City Center),MPE,23.198,94.052,"Near City Center, Kalay",Kalay,Kalay,MM
CNPC Fuel Station (Kalay),CNPC,23.188,94.059,Kalay-Gangaw Road,Kalay,Kalay,MM
Yadanar Maung Filling Station,,24.327,94.382,Tamu-Kalay Road,Tamu,Kalay,MM
Tun Thitsar Filling Station,,24.324,94.384,Tamu-Kalay Road,Tamu,Kalay,MM
Zaw Win Htike Filling Station,,24.335,94.386,Tamu-Kalay Road,Tamu,Kalay,MM
Myoma Filling Station,,24.337,94.385,Tamu,Tamu,Kalay,MM
Unknown Fuel Station,,22.65,94.35,Mingin-Kalaywa Road,Mingin,Kalay,MM
Unknown Fuel Station,,22.6,94.3,Mingin-Kalaywa Road,Mingin,Kalay,MM
Yadanarpon Petrol Station,MPE,23.1925,94.3222,Kalewa-Gangaw Road,Kalewa,Kalay,MM
Aung Zaya Petrol Station,,23.186,94.3265,Near Kalewa Bridge,Kalewa,Kalay,MM
Shwe Pyi Tan Petrol Station,,23.197,94.32,Unknown,Kalewa,Kalay,MM
Win Myanmar Petrol Station,,23.1905,94.3245,Unknown,Kalewa,Kalay,MM
Shwe Sin Setkya Fuel Station,Unknown,23.188,94.038,"Near Kalay University, Kalay",Kalay,Kalay,MM
Aye Mya Thandar Fuel Station,Unknown,23.18,94.045,"Sittwe Road, Kalay",Kalay,Kalay,MM
Kyaw Zaya Fuel Station,Unknown,23.175,94.03,"Near Kalay Myoma Market, Kalay",Kalay,Kalay,MM
Phyo Min Thu Fuel Station,Unknown,23.168,94.025,"Behind General Hospital, Kalay",Kalay,Kalay,MM
Htoo Eain Thin Fuel Station,Unknown,23.195,94.05,"Tamu Road, Kalay",Kalay,Kalay,MM
Nga Laung Bo Bo Fuel Station,Unknown,23.182,94.018,"North of Kalay Airport, Kalay",Kalay,Kalay,MM
Oak Pho Fuel Station,Unknown,23.17,94.035,"Close to Kalay Railway Station, Kalay",Kalay,Kalay,MM
Zin Yaw Myint Fuel Station,Unknown,23.162,94.02,"Southern Kalay, near Industrial Zone",Kalay,Kalay,MM
Myat Mandalar Fuel Station,Unknown,23.19,94.04,Beside Kalay-Tamu Highway,Kalay,Kalay,MM
Shwe Nan Taw Fuel Station,Unknown,23.177,94.027,"Near Technological University, Kalay",Kalay,Kalay,MM
Min Tayar Fuel Station,Unknown,23.185,94.047,Along the main road,Kalay,Kalay,MM
Yadanar Thike Filling Station,Unknown,23.173,94.033,Near the bus station,Kalay,Kalay,MM
Aung Barani Petrol Station,Unknown,23.165,94.023,On the outskirts of town,Kalay,Kalay,MM
Shwe Hintha Filling Station,Unknown,23.183,94.036,Close to the city center,Kalay,Kalay,MM
Myat Phone Maw Fuel Station,Unknown,23.178,94.042,"Main Street, Kalay",Kalay,Kalay,MM
Mawlaik Highway Fuel Station,Unknown,23.657,94.412,Mawlaik-Kalay Road,Mawlaik,Mawlaik,MM
MPE Fuel Station Mawlaik,MPE,23.655,94.415,Near Mawlaik town entrance,Mawlaik,Mawlaik,MM
Paungbyin Fuel Station,,24.25,94.65,Paungbyin,Paungbyin,Mawlaik,MM
Aung Myin Fuel Station,Unknown,24.1485,94.4022,Mawlaik Township,Mawlaik,Mawlaik,MM
Shwe Taung Yoe Fuel Station,Unknown,24.1458,94.4055,"Mawlaik-Kalay Road, Mawlaik Township",Mawlaik,Mawlaik,MM
Myoma Fuel Station,Unknown,24.152,94.398,"Myoma Quarter, Mawlaik Township",Mawlaik,Mawlaik,MM
Yadanarbon Fuel Station,Unknown,24.1392,94.4125,"Near Mawlaik Airport, Mawlaik Township",Mawlaik,Mawlaik,MM
Mawlaik Main Fuel Depot,Unknown,24.1471,94.4008,"West of Mawlaik, Mawlaik Township",Mawlaik,Mawlaik,MM
Kyaw Zeya Fuel Station,Unknown,24.1502,94.4031,"Mawlaik, Near the Market",Mawlaik,Mawlaik,MM
New Generation Fuel Station,Unknown,24.1428,94.4097,East of Mawlaik City,Mawlaik,Mawlaik,MM
San Lwin Fuel Station,Unknown,24.1545,94.3952,North Mawlaik,Mawlaik,Mawlaik,MM
Shwe Pyi Tan Fuel Station,Unknown,24.1369,94.4154,"Near the River, Mawlaik",Mawlaik,Mawlaik,MM
Aung Thapyay Fuel Station,Unknown,24.1493,94.4015,"Mawlaik Township, Downtown Area",Mawlaik,Mawlaik,MM
Mawlaik Yoma Fuel Station,Unknown,24.1411,94.4119,"Highway, East of Mawlaik",Mawlaik,Mawlaik,MM
Min Thar Gyi Fuel Station,Unknown,24.1532,94.3969,Northwest Mawlaik,Mawlaik,Mawlaik,MM
Golden Land Fuel Station,Unknown,24.1385,94.4138,Close to the Airport Road,Mawlaik,Mawlaik,MM
Shwe Hintha Fuel Station,Unknown,24.1465,94.4041,"Main Street, Mawlaik",Mawlaik,Mawlaik,MM
Thet Shay Fuel Station,Unknown,24.1511,94.3994,"Mawlaik, Near the Clinic",Mawlaik,Mawlaik,MM
Lin Lat Fuel Station,Unknown,24.1445,94.4073,"Opposite the School, Mawlaik",Mawlaik,Mawlaik,MM
Hkamti Fuel Station 1,,25.83,95.72,Hkamti Road,Hkamti,Hkamti,MM
Hkamti Petrol Station,MPE,25.84,95.71,,Hkamti,Hkamti,MM
Fuel Station Hkamti,,25.82,95.73,Near Market,Hkamti,Hkamti,MM
Homalin Filling Station,,24.86,94.88,Homalin,Homalin,Hkamti,MM
Homalin Fuel Station,,24.87,94.87,Homalin,Homalin,Hkamti,MM
Leshi Fuel Station,,26.1667,95.7833,Leshi Main Road,Leshi,Hkamti,MM
MPE Fuel Station Leshi,MPE,26.17,95.79,Near Leshi Market,Leshi,Hkamti,MM
Aung Myint Myat Fuel Station,Unknown,25.8345,95.6789,Hkamti Township,Hkamti,Hkamti,MM
Shwe Thanlwin Fuel Station,Unknown,25.8456,95.689,Near Hkamti Airport,Hkamti,Hkamti,MM
Nang Pin Fuel Station,Unknown,25.8234,95.6678,Hkamti Main Road,Hkamti,Hkamti,MM
Hkamti Yoma Fuel Station,Unknown,25.8567,95.6901,Upper Hkamti,Hkamti,Hkamti,MM
Zawgyi Fuel Station,Unknown,25.8123,95.6567,Southern Hkamti,Hkamti,Hkamti,MM
Myit Sone Fuel Station,Unknown,25.8678,95.7012,Northern Hkamti,Hkamti,Hkamti,MM
Hkamti Thitsar Fuel Station,Unknown,25.8012,95.6456,Near the market,Hkamti,Hkamti,MM
Shwe Pyi Tan Fuel Station,Unknown,25.8789,95.7123,Outskirts of Hkamti,Hkamti,Hkamti,MM
Emerald Region Fuel Station,Unknown,25.83,95.67,Hkamti near hospital,Hkamti,Hkamti,MM
Kachin Land Fuel Station,Unknown,25.85,95.69,Hkamti Near School,Hkamti,Hkamti,MM
Sinphyu Myaing Fuel Station,Unknown,25.81,95.65,West Hkamti,Hkamti,Hkamti,MM
Maha Bandula Fuel Station,Unknown,25.87,95.71,East Hkamti,Hkamti,Hkamti,MM
Aye Yarwady Fuel Station,Unknown,25.834,95.68,On Hkamti Main Road,Hkamti,Hkamti,MM
MPE Gas Station,MPE,17.24,96.43,"Yangon-Mandalay Expressway, near mile marker 60",Bago,Yangon-Mandalay Highway,MM
Shwe Taung Gas Station,Shwe Taung,18.78,96.32,"Yangon-Mandalay Expressway, near mile marker 140",Pyu,Yangon-Mandalay Highway,MM
MPT Gas Station,MPT,19.73,96.35,"Yangon-Mandalay Expressway, near mile marker 200",Tatkon,Yangon-Mandalay Highway,MM
PTT Gas Station,PTT,20.92,96.12,"Yangon-Mandalay Expressway, near mile marker 280",Yamethin,Yangon-Mandalay Highway,MM
MPE Gas Station,MPE,21.65,96.08,"Yangon-Mandalay Expressway, near mile marker 320",Meiktila,Yangon-Mandalay Highway,MM
Shwe Byain Phyu Gas Station,Shwe Byain Phyu,21.98,96.06,"Yangon-Mandalay Expressway, near mile marker 340",Thazi,Yangon-Mandalay Highway,MM
Total Gas Station,Total,20.35,96.25,Yangon-Mandalay Expressway,Lewe,Yangon-Mandalay Highway,MM
Gas Station,Unknown,17.76,96.42,"Yangon-Mandalay Expressway, near Bago",Bago,Yangon-Mandalay Highway,MM
Gas Station,Unknown,19.32,96.37,Yangon-Mandalay Expressway,Pyinmana,Yangon-Mandalay Highway,MM
Gas Station,Unknown,21.45,96.05,Yangon-Mandalay Expressway,Meiktila,Yangon-Mandalay Highway,MM
MPE Gas Station,MPE,16.78,96.33,"NH1, near Hlegu",Hlegu,Yangon-Mawlamyine Highway,MM
Shwe Taung Gas Station,Shwe Taung,16.65,96.45,"NH1, near Bago River Bridge",Hlegu,Yangon-Mawlamyine Highway,MM
MPE Gas Station,MPE,16.5,96.55,"NH1, near Thanatpin",Thanatpin,Yangon-Mawlamyine Highway,MM
PTT Gas Station,PTT,16.75,97.03,"NH1, near Waw",Waw,Yangon-Mawlamyine Highway,MM
Shwe Taung Gas Station,Shwe Taung,16.9,97.25,"NH1, near Payagyi",Payagyi,Yangon-Mawlamyine Highway,MM
MPE Gas Station,MPE,17.05,97.35,"NH1, near Kyaikto",Kyaikto,Yangon-Mawlamyine Highway,MM
PTT Gas Station,PTT,16.48,97.58,"NH1, near Theinzayat",Kyaikto,Yangon-Mawlamyine Highway,MM
Shwe Taung Gas Station,Shwe Taung,16.45,97.63,"NH1, near Theinzayat",Kyaikto,Yangon-Mawlamyine Highway,MM
MPE Gas Station,MPE,16.92,97.68,"NH1, near Mottama",Mottama,Yangon-Mawlamyine Highway,MM
PTT Gas Station,PTT,16.5,97.65,"NH1, near Kyaikkhami",Thanbyuzayat,Yangon-Mawlamyine Highway,MM
Total Gas Station,Total,16.48,97.7,"NH1, near Thanbyuzayat",Thanbyuzayat,Yangon-Mawlamyine Highway,MM
MPE Filling Station,MPE,16.903,95.962,"Yangon-Pathein Rd, near Yay Twin Kone Village",Hlegu,Yangon-Pathein Highway,MM
Shwe Taung Filling Station,Shwe Taung,17.125,95.748,"Yangon-Pathein Rd, near Nattalin Junction",Nattalin,Yangon-Pathein Highway,MM
PTT Filling Station,PTT,17.351,95.532,"Yangon-Pathein Rd, near Zalon",Zalon,Yangon-Pathein Highway,MM
Total Filling Station,Total,17.628,95.315,"Yangon-Pathein Rd, near Ingapu",Ingapu,Yangon-Pathein Highway,MM
MPE Filling Station,MPE,17.854,95.101,"Yangon-Pathein Rd, near Myanaung",Myanaung,Yangon-Pathein Highway,MM
Shwe Taung Filling Station,Shwe Taung,18.077,94.886,"Yangon-Pathein Rd, near Kangyidaung",Kangyidaung,Yangon-Pathein Highway,MM
PTT Filling Station,PTT,18.302,94.671,"Yangon-Pathein Rd, on the outskirts of Pathein",Pathein,Yangon-Pathein Highway,MM
MPE Filling Station,MPE,18.453,94.733,Corner of Strand Rd and Thit Sar Street,Pathein,Yangon-Pathein Highway,MM
MPE Filling Station,MPE,17.05,96.15,"Yangon-Pyay Highway, near Hlegu",Hlegu,Yangon-Pyay Highway,MM
Shwe Taung Filling Station,Shwe Taung,17.85,95.75,"Yangon-Pyay Highway, near Oakkan",Oakkan,Yangon-Pyay Highway,MM
PTT Filling Station,PTT,18.35,95.5,"Yangon-Pyay Highway, near Tharrawaddy",Tharrawaddy,Yangon-Pyay Highway,MM
Total Filling Station,Total,17.6,95.4,Near Letpadan,Letpadan,Yangon-Pyay Highway,MM
MPE Filling Station,MPE,18.8,95.3,Yangon-Pyay Highway,Gyobingauk,Yangon-Pyay Highway,MM
Shwe Byain Phyu Filling Station,Unknown,18.95,95.2,Near Zigon,Zigon,Yangon-Pyay Highway,MM
Filling Station,Unknown,19.1,95.2,Yangon-Pyay Highway,Minhla,Yangon-Pyay Highway,MM
Filling Station,Unknown,18.8188,95.1749,Yangon-Pyay Highway,Gyobingauk,Yangon-Pyay Highway,MM
PTT Filling Station,PTT,18.6,95.1,"Yangon-Pyay Highway, near Gyobingauk",Gyobingauk,Yangon-Pyay Highway,MM
MPE Gas Station,MPE,17.635,95.234,"Pathein-Hinthada Road, near Kyonpyaw",Kyonpyaw,Pathein-Hinthada Highway,MM
Shwe Taung Gas Station,Shwe Taung,17.312,95.456,"Pathein-Hinthada Road, near Kangyi Daunk",Kangyi Daunk,Pathein-Hinthada Highway,MM
PTT Gas Station,PTT,17.012,95.678,"Pathein-Hinthada Road, near Pantanaw",Pantanaw,Pathein-Hinthada Highway,MM
Total Gas Station,Total,17.645,95.789,"Pathein-Hinthada Road, near Nyaungdon",Nyaungdon,Pathein-Hinthada Highway,MM
MPE Gas Station,MPE,17.456,95.901,Pathein-Hinthada Road,Danubyu,Pathein-Hinthada Highway,MM
Shwe Taung Gas Station,Shwe Taung,17.89,96.012,Pathein-Hinthada Road,Zalun,Pathein-Hinthada Highway,MM
Gas Station,Unknown,18.023,95.423,"Pathein-Hinthada Road, near Laymyethna",Laymyethna,Pathein-Hinthada Highway,MM
Gas Station,Unknown,18.222,95.623,"Pathein-Hinthada Road, near Hinthada",Hinthada,Pathein-Hinthada Highway,MM
MPE Filling Station (Twante),MPE,16.74,95.92,"Yangon-Twante Road, near Twante bridge",Twante,Yangon-Twante Highway,MM
Shwe Taung Filling Station (Twante),Shwe Taung,16.73,95.92,"Yangon-Twante Road, near Twante",Twante,Yangon-Twante Highway,MM
Filling Station (Dala),Unknown,16.77,96.14,"Yangon-Twante Road, Dala",Dala,Yangon-Twante Highway,MM
MPE Petrol Station,MPE,16.77,94.74,Pathein-Myaungmya Road,Pathein,Pathein-Myaungmya Highway,MM
Shwe Taung Petrol Station,Shwe Taung,16.74,94.71,Pathein-Myaungmya Road,Pathein,Pathein-Myaungmya Highway,MM
PTT Petrol Station,PTT,16.68,94.65,Pathein-Myaungmya Road,Kangyi Daunk,Pathein-Myaungmya Highway,MM
Unknown Petrol Station,Unknown,16.54,94.52,Pathein-Myaungmya Road,Wakema,Pathein-Myaungmya Highway,MM
MPE Petrol Station,MPE,16.5,94.48,Pathein-Myaungmya Road,Wakema,Pathein-Myaungmya Highway,MM
Shwe Taung Petrol Station,Shwe Taung,16.4,94.41,Pathein-Myaungmya Road,Myaungmya,Pathein-Myaungmya Highway,MM
PTT Petrol Station,PTT,16.38,94.39,Pathein-Myaungmya Road,Myaungmya,Pathein-Myaungmya Highway,MM
Unknown Fuel Station,Unknown,16.56,95.4,"Myaungmya-Pyapon Road, near Kyauk Chaung village",Myaungmya,Myaungmya-Pyapon Highway,MM
Unknown Fuel Station,Unknown,16.44,95.54,"Myaungmya-Pyapon Road, near Kadonkan village",Einme,Myaungmya-Pyapon Highway,MM
Unknown Fuel Station,Unknown,16.41,95.6,Myaungmya-Pyapon Road,Einme,Myaungmya-Pyapon Highway,MM
Unknown Fuel Station,Unknown,16.34,95.68,"Myaungmya-Pyapon Road, near Ngaputaw junction",Einme,Myaungmya-Pyapon Highway,MM
Unknown Fuel Station,Unknown,16.25,95.78,Myaungmya-Pyapon Road,Einme,Myaungmya-Pyapon Highway,MM
Unknown Fuel Station,Unknown,16.14,95.88,Myaungmya-Pyapon Road,Pyapon,Myaungmya-Pyapon Highway,MM
Unknown Fuel Station,Unknown,16.09,95.94,"Myaungmya-Pyapon Road, close to Pyapon",Pyapon,Myaungmya-Pyapon Highway,MM
MPE Filling Station,MPE,19.18,95.22,"Pyay-Magway Road, near Thayet",Thayet,Pyay-Magway Highway,MM
Shwe Taung Filling Station,Shwe Taung,19.15,95.25,"Pyay-Magway Road, Thayet",Thayet,Pyay-Magway Highway,MM
MPE Filling Station,MPE,20.78,94.92,"Pyay-Magway Road, Natmauk Township",Natmauk,Pyay-Magway Highway,MM
Unknown Filling Station,Unknown,20.95,94.9,"Pyay-Magway Road, near Taungdwingyi",Taungdwingyi,Pyay-Magway Highway,MM
Magway Filling Station,Unknown,20.14,94.88,Myothit,Myothit,Pyay-Magway Highway,MM
MPE Filling Station,MPE,20.14,94.93,"Magway-Pakokku Road, near Magway",Magway,Magway-Pakokku Highway,MM
Shwe Taung Filling Station,Shwe Taung,20.45,94.85,"Magway-Pakokku Road, near Minbu",Minbu,Magway-Pakokku Highway,MM
Yenangyaung Filling Station (Unknown Brand),Unknown,20.46,94.74,"Magway-Pakokku Road, Yenangyaung",Yenangyaung,Magway-Pakokku Highway,MM
PTT Filling Station,PTT,20.93,94.62,"Magway-Pakokku Road, near Chauk",Chauk,Magway-Pakokku Highway,MM
Total Filling Station,Total,21.34,94.98,"Magway-Pakokku Road, Pakokku",Pakokku,Magway-Pakokku Highway,MM
MPE Filling Station (Pakokku),MPE,21.33,95,"Near Pakokku University, Pakokku",Pakokku,Magway-Pakokku Highway,MM
MPE Filling Station,MPE,21.35,95.2,"Pakokku-Mandalay Road, near Pakokku",Pakokku,Pakokku-Mandalay Highway,MM
Shwe Taung Filling Station,Shwe Taung,21.1,95.4,"Pakokku-Mandalay Road, near Yesagyo turnoff",Pakokku,Pakokku-Mandalay Highway,MM
MPT Filling Station,MPT,21,95.5,Pakokku-Mandalay Road,Yesagyo,Pakokku-Mandalay Highway,MM
Filling Station,Unknown,20.7,95.7,"Pakokku-Mandalay Road, north of Myingyan",Myingyan,Pakokku-Mandalay Highway,MM
MPE Filling Station,MPE,20.5,95.9,"Pakokku-Mandalay Road, Myingyan",Myingyan,Pakokku-Mandalay Highway,MM
PTT Filling Station,PTT,20.3,96,"Pakokku-Mandalay Road, near Myingyan",Myingyan,Pakokku-Mandalay Highway,MM
Filling Station,Unknown,20,96.1,Pakokku-Mandalay Road,Natogyi,Pakokku-Mandalay Highway,MM
MPE Filling Station,MPE,19.7,96.2,"Pakokku-Mandalay Road, near Tada-U",Tada-U,Pakokku-Mandalay Highway,MM
Shwe Taung Filling Station,Shwe Taung,22,96,Near Mandalay,Amarapura,Pakokku-Mandalay Highway,MM
MPE Filling Station,MPE,22.005,96.078,"Mandalay-Pyin Oo Lwin Road, near Mandalay University",Amarapura,Mandalay-Pyin-Oo-Lwin Highway,MM
Shwe Taung Filling Station,Shwe Taung,22.032,96.065,"Mandalay-Pyin Oo Lwin Road, near Telecom University",Chanmyathazi,Mandalay-Pyin-Oo-Lwin Highway,MM
Total Filling Station,Total,22.06,96.05,"Mandalay-Pyin Oo Lwin Road, north of Mandalay",Patheingyi,Mandalay-Pyin-Oo-Lwin Highway,MM
PTT Filling Station,PTT,22.08,96.03,"Mandalay-Pyin Oo Lwin Road, north of Mandalay",Patheingyi,Mandalay-Pyin-Oo-Lwin Highway,MM
Filling Station (Likely Empty),Empty,22.13,96.01,Mandalay-Pyin Oo Lwin Road,Patheingyi,Mandalay-Pyin-Oo-Lwin Highway,MM
Filling Station,Unknown,22.18,95.98,"Mandalay-Pyin Oo Lwin Road, Naung Cho township border",Patheingyi,Mandalay-Pyin-Oo-Lwin Highway,MM
MPE Filling Station,MPE,22.194,95.978,"Mandalay-Pyin Oo Lwin Road, near Anisakhan",Naung Cho,Mandalay-Pyin-Oo-Lwin Highway,MM
Shwe Taung Filling Station,Shwe Taung,22.005,96.058,"Mandalay-Pyin Oo Lwin Road, near Mandalay University",Amarapura,Mandalay-Pyin-Oo-Lwin Highway,MM
MPE Filling Station,MPE,21.88,96.07,"Mandalay-Kyaukse Road, near Mandalay city limits",Amarapura,Mandalay-Nyaung-U Highway,MM
Shwe Taung Filling Station,Shwe Taung,21.55,95.98,"Mandalay-Kyaukse Road, near Tada-U",Tada-U,Mandalay-Nyaung-U Highway,MM
PTT Filling Station,PTT,21.33,95.92,"Mandalay-Kyaukse Road, Kyaukse",Kyaukse,Mandalay-Nyaung-U Highway,MM
MPE Filling Station,MPE,21.32,95.92,"Mandalay-Kyaukse Road, Kyaukse",Kyaukse,Mandalay-Nyaung-U Highway,MM
Filling Station,Unknown,21.1,95.78,"Mandalay-Myingyan Road, near Sintgaing",Sintgaing,Mandalay-Nyaung-U Highway,MM
Filling Station,Unknown,21.01,95.68,"Mandalay-Myingyan Road, near Myittha",Myittha,Mandalay-Nyaung-U Highway,MM
PTT Filling Station,PTT,20.88,95.59,"Mandalay-Myingyan Road, Myingyan",Myingyan,Mandalay-Nyaung-U Highway,MM
Shwe Taung Filling Station,Shwe Taung,20.87,95.58,"Mandalay-Myingyan Road, Myingyan",Myingyan,Mandalay-Nyaung-U Highway,MM
MPE Filling Station,MPE,20.86,95.57,"Mandalay-Myingyan Road, Myingyan",Myingyan,Mandalay-Nyaung-U Highway,MM
Filling Station,Unknown,20.52,95.31,"Myingyan-Nyaung-U Road, near Natogyi",Natogyi,Mandalay-Nyaung-U Highway,MM
Filling Station,Unknown,20.33,95.15,Myingyan-Nyaung-U Road,Taungtha,Mandalay-Nyaung-U Highway,MM
Filling Station,Unknown,20.12,94.99,Myingyan-Nyaung-U Road,Nyaung-U,Mandalay-Nyaung-U Highway,MM
Filling Station,Unknown,21.74,95.91,Kyaukse-Mandalay Road,Kyaukse,Mandalay-Nyaung-U Highway,MM
Filling Station,Unknown,21.6,95.94,Kyaukse-Mandalay Road,Kyaukse,Mandalay-Nyaung-U Highway,MM
MPE Filling Station,MPE,20.87,95.87,"Meiktila-Mandalay Road, near mile marker",Meiktila,Meiktila-Mandalay Highway,MM
Shwe Taung Filling Station,Shwe Taung,21.05,96.02,On the main road to Thazi,Thazi,Meiktila-Mandalay Highway,MM
PTT Filling Station,PTT,21.2,96.08,Near Thazi town center,Thazi,Meiktila-Mandalay Highway,MM
Total Filling Station,Total,21.45,96.15,"Along Meiktila-Mandalay Road, between Thazi and Yamethin",Yamethin,Meiktila-Mandalay Highway,MM
MPE Filling Station,MPE,21.6,96.22,Yamethin main road,Yamethin,Meiktila-Mandalay Highway,MM
Unknown Filling Station,Unknown,21.85,96.3,Near mile marker along Meiktila-Mandalay Road,Pyawbwe,Meiktila-Mandalay Highway,MM
Shwe Byain Phyu Filling Station,Shwe Byain Phyu,22,96.05,Between Pyawbwe and Mandalay,Pyawbwe,Meiktila-Mandalay Highway,MM
MPT Filling Station,MPT,21.96,96.34,"Along Meiktila-Mandalay Road, near highway exit",Pyawbwe,Meiktila-Mandalay Highway,MM
Filling Station,Unknown,22.35,96,Near Mandalay,Tada-U,Meiktila-Mandalay Highway,MM
MPE Fuel Station,MPE,22,96.46,"Mandalay-Lashio Road, near Pyin Oo Lwin exit",Pyin Oo Lwin,Mandalay-Lashio Highway,MM
Shwe Taung Fuel Station,Shwe Taung,22.03,96.47,"Mandalay-Lashio Road, near Pyin Oo Lwin",Pyin Oo Lwin,Mandalay-Lashio Highway,MM
MPT Fuel Station,MPT,22.04,96.48,"Mandalay-Lashio Road, Pyin Oo Lwin",Pyin Oo Lwin,Mandalay-Lashio Highway,MM
Unknown Fuel Station,Unknown,22.75,97.25,"Mandalay-Lashio Road, near Gokteik Viaduct",Naung Cho,Mandalay-Lashio Highway,MM
MPE Fuel Station,MPE,22.64,97.35,"Mandalay-Lashio Road, Hsipaw",Hsipaw,Mandalay-Lashio Highway,MM
Shwe Byain Phyu Fuel Station,Shwe Byain Phyu,22.63,97.34,"Mandalay-Lashio Road, Hsipaw",Hsipaw,Mandalay-Lashio Highway,MM
Unknown Fuel Station,Unknown,22.62,97.33,"Mandalay-Lashio Road, Hsipaw",Hsipaw,Mandalay-Lashio Highway,MM
Total Fuel Station,Total,22.98,97.75,"Mandalay-Lashio Road, Kyaukme",Kyaukme,Mandalay-Lashio Highway,MM
PTT Fuel Station,PTT,22.97,97.74,"Mandalay-Lashio Road, Kyaukme",Kyaukme,Mandalay-Lashio Highway,MM
Shwe Taung Fuel Station,Shwe Taung,22.96,97.73,"Mandalay-Lashio Road, Kyaukme",Kyaukme,Mandalay-Lashio Highway,MM
MPE Fuel Station,MPE,22.95,97.72,"Mandalay-Lashio Road, Kyaukme",Kyaukme,Mandalay-Lashio Highway,MM
Shwe Taung Fuel Station,Shwe Taung,22.94,97.71,"Mandalay-Lashio Road, Kyaukme",Kyaukme,Mandalay-Lashio Highway,MM
Unknown Fuel Station,Unknown,23.05,97.79,"Mandalay-Lashio Road, Northern Kyaukme",Kyaukme,Mandalay-Lashio Highway,MM
MPE Fuel Station,MPE,23.04,97.78,"Mandalay-Lashio Road, Northern Kyaukme",Kyaukme,Mandalay-Lashio Highway,MM
Shwe Taung Fuel Station,Shwe Taung,23.03,97.77,"Mandalay-Lashio Road, Northern Kyaukme",Kyaukme,Mandalay-Lashio Highway,MM
MPE Fuel Station,MPE,22.93,97.88,Mandalay-Lashio Road,Kyaukme,Mandalay-Lashio Highway,MM
MPE Fuel Station,MPE,22.93,97.89,Mandalay-Lashio Road,Kyaukme,Mandalay-Lashio Highway,MM
PTT Fuel Station,PTT,22.9,97.92,"Mandalay-Lashio Road, near Nawnghkio",Nawnghkio,Mandalay-Lashio Highway,MM
MPT Fuel Station,MPT,22.89,97.93,"Mandalay-Lashio Road, near Nawnghkio",Nawnghkio,Mandalay-Lashio Highway,MM
Shwe Taung Fuel Station,Shwe Taung,22.88,97.94,"Mandalay-Lashio Road, near Nawnghkio",Nawnghkio,Mandalay-Lashio Highway,MM
MPE Fuel Station,MPE,22.91,97.91,"Mandalay-Lashio Road, near Nawnghkio",Nawnghkio,Mandalay-Lashio Highway,MM
PTT Fuel Station,PTT,22.92,97.9,"Mandalay-Lashio Road, near Nawnghkio",Nawnghkio,Mandalay-Lashio Highway,MM
Shwe Taung Fuel Station,Shwe Taung,22.94,97.88,"Mandalay-Lashio Road, near Nawnghkio",Nawnghkio,Mandalay-Lashio Highway,MM
MPE Fuel Station,MPE,22.95,97.87,"Mandalay-Lashio Road, near Nawnghkio",Nawnghkio,Mandalay-Lashio Highway,MM
PTT Fuel Station,PTT,22.96,97.86,"Mandalay-Lashio Road, near Nawnghkio",Nawnghkio,Mandalay-Lashio Highway,MM
