name,brand,lat,lng,address_text,township,city,country_code
Thiri Sandar Filling Station,,20.866,94.82,Unknown,Chauk,Magway,MM
Aung Yadana Filling Station,,20.334,95.188,"Near Natmauk Myoma Market, Natmauk",Natmauk,Magway,MM
Natmauk Shwe Taung,Shwe Taung,20.335,95.19,"Natmauk-Magway Road, Natmauk",Natmauk,Magway,MM
Yadanar Thike Filling Station,,20.33,95.185,"Natmauk, Myanmar",Natmauk,Magway,MM
MPE Taungdwingyi,MPE,19.76,95.29,Yangon-Mandalay Road,Taungdwingyi,Magway,MM
Shwe Taung Taungdwingyi,Shwe Taung,19.75,95.3,Near Taungdwingyi Town,Taungdwingyi,Magway,MM
Aye Chan Thar Petrol Station,,19.74,95.28,Taungdwingyi,Taungdwingyi,Magway,MM
Aung Lan Yadanar Fuel Station,MPT,19.7266,95.2533,Aunglan-Mindon Road,Aunglan,Magway,MM
Aung Lan Min Tar Fuel Station,Unknown,19.719,95.2555,Aunglan-Mindon Road,Aunglan,Magway,MM
Shwe Padauk Fuel Station,Unknown,19.7179,95.2544,Aunglan-Mindon Road,Aunglan,Magway,MM
Myoma Fuel Station,Unknown,20.145,94.945,"Myoma Road, Magway",Magway,Magway,MM
Yadanabon Fuel Station,Unknown,20.15,94.95,"Near Yadanabon Pagoda, Magway",Magway,Magway,MM
Min Thar Filling Station,Unknown,20.055,95.055,"Min Thar Village, Magway Township",Magway,Magway,MM
Shwe Pyi Tan Fuel Station,Unknown,19.76,95.26,Taungdwingyi,Taungdwingyi,Magway,MM
Aung Thitsar Fuel Station,Unknown,19.77,95.27,Taungdwingyi,Taungdwingyi,Magway,MM
Sein Yadanar Fuel Station,Unknown,19.855,95.155,"Near Sein Yadanar Market, Taungdwingyi",Taungdwingyi,Magway,MM
Pin Chaung Fuel Station,Unknown,20.456,94.654,"Pin Chaung Village, Magway",Magway,Magway,MM
Pakokku Fuel Station,Unknown,21.333,95.111,Pakokku,Pakokku,Magway,MM
Yesagyo Fuel Station,Unknown,21.444,94.888,Yesagyo,Yesagyo,Magway,MM
Myaing Fuel Station,Unknown,21.666,94.666,Myaing,Myaing,Magway,MM
Gangaw Fuel Station,Unknown,22.111,94.333,Gangaw,Gangaw,Magway,MM
Htilin Fuel Station,Unknown,22.333,94.111,Htilin,Htilin,Magway,MM
Saw Fuel Station,Unknown,21.888,94.444,Saw,Saw,Magway,MM
Aung Chan Thar (Natmauk),Unknown,20.35,95.3,Natmauk,Natmauk,Magway,MM
Shwe Zedi Fuel Station,Unknown,20.09,94.93,"Near Shwe Zedi Pagoda, Magway",Magway,Magway,MM
Pauk Fuel Station,Unknown,21.5,94.9,Pauk,Pauk,Magway,MM
MPE Minbu Station,MPE,20.18,94.88,Near Minbu-Ann Road,Minbu,Minbu,MM
Shwe Taung Minbu Station,Shwe Taung,20.19,94.87,Minbu-Magway Road,Minbu,Minbu,MM
CNPC Minbu Station,CNPC,20.2,94.86,Near Minbu Airport,Minbu,Minbu,MM
Shwe Padauk Oil Station,MPE,20.3371,94.7473,Sagu-Minbu Road,Sagu,Minbu,MM
Unknown Fuel Station,,20.3066,94.7281,Near Sagu,Sagu,Minbu,MM
Mya Yadana Petrol Station,,20.3288,94.7446,Sagu,Sagu,Minbu,MM
Ngape Filling Station,MPE,19.875,94.64,Ngape-Minbu Road,Ngape,Minbu,MM
Pwintbyu Petrol Station,MPE,20.04,94.65,"Main Road, Pwintbyu",Pwintbyu,Minbu,MM
Shwe Taung Filling Station,Shwe Taung,20.03,94.66,Yangon-Bagan Road,Pwintbyu,Minbu,MM
CNPC Pwintbyu,CNPC,20.02,94.64,Near Pwintbyu Market,Pwintbyu,Minbu,MM
Salin Fuel Station,MPE,20.253,94.788,Near Salin Town Entrance,Salin,Minbu,MM
Shwe Taung Petrol Station,Shwe Taung,20.245,94.78,Salin-Minbu Road,Salin,Minbu,MM
CNPC Fuel Station,CNPC,20.26,94.795,"Main Road, Salin",Salin,Minbu,MM
Aung Myin Fuel Station,,20.189,94.882,Minbu Township,Minbu,Minbu,MM
Yadanar Thike Fuel Station,,20.185,94.878,Minbu Township,Minbu,Minbu,MM
Win Star Fuel Station,,20.192,94.885,Minbu Township,Minbu,Minbu,MM
Myoma Fuel Station,,20.198,94.891,Minbu Township,Minbu,Minbu,MM
Zaw Zaw Fuel Station,,20.175,94.87,Minbu Township,Minbu,Minbu,MM
Nilar Fuel Station,,20.18,94.875,Minbu Township,Minbu,Minbu,MM
Aye Myint Thu Fuel Station,,20.183,94.88,Minbu Township,Minbu,Minbu,MM
Mya Nandar Fuel Station,,20.178,94.873,Minbu Township,Minbu,Minbu,MM
Shwe Pyi Tan Fuel Station,,20.195,94.888,Minbu Township,Minbu,Minbu,MM
Kyaw Zaya Fuel Station,,20.187,94.883,Minbu Township,Minbu,Minbu,MM
Phyo Thiri Fuel Station,,20.173,94.868,Minbu Township,Minbu,Minbu,MM
Htet Htet Wai Fuel Station,,20.19,94.886,Minbu Township,Minbu,Minbu,MM
Pyi Hein Fuel Station,,20.193,94.889,Minbu Township,Minbu,Minbu,MM
MPE Filling Station,MPE,19.32,95.205,Minbu - Thayet Road,Thayet,Thayet,MM
Shwe Taung Filling Station,Shwe Taung,19.305,95.18,Near Thayet Bridge,Thayet,Thayet,MM
PTT Filling Station,PTT,19.315,95.21,Thayet-Aunglan Road,Thayet,Thayet,MM
Unknown Station,,19.65,94.73,Mindon-Aunglan Road,Mindon,Thayet,MM
Unknown Station,,19.63,94.72,Mindon,Mindon,Thayet,MM
Kyaw Kyaw Bo Filling Station,MPE,19.654,95.207,"Main Road, Kamma",Kamma,Thayet,MM
Unknown Filling Station,,19.661,95.215,Kamma-Aunglan Road,Kamma,Thayet,MM
Sinbaungwe Fuel Station,,19.78,95.24,"Main Road, Sinbaungwe",Sinbaungwe,Thayet,MM
MPE Fuel Station,MPE,19.77,95.23,Near Sinbaungwe Market,Sinbaungwe,Thayet,MM
Aung Myin Thu Filling Station,Unknown,19.3045,95.2012,Thayet,Thayet,Thayet,MM
Myint Mo Filling Station,Unknown,19.3082,95.1897,Thayet,Thayet,Thayet,MM
Zaw Zaw Filling Station,Unknown,19.3129,95.1944,Thayet,Thayet,Thayet,MM
Shwe Byain Nyo Filling Station,Unknown,19.3068,95.1975,Thayet,Thayet,Thayet,MM
Aung Tagun Filling Station,Unknown,19.2991,95.2053,Thayet,Thayet,Thayet,MM
Kyaw Zeya Filling Station,Unknown,19.3051,95.1911,Thayet,Thayet,Thayet,MM
Mya Yadanar Filling Station,Unknown,19.3105,95.1859,Thayet,Thayet,Thayet,MM
Yadanarpon Filling Station,Unknown,19.3027,95.1937,Thayet,Thayet,Thayet,MM
Shwe Nant Thar Filling Station,Unknown,19.3094,95.2038,Thayet,Thayet,Thayet,MM
Htoo Aung Filling Station,Unknown,19.3132,95.1981,Thayet,Thayet,Thayet,MM
Aung Gabar Filling Station,Unknown,19.3076,95.2079,Thayet,Thayet,Thayet,MM
Win Filling Station,Unknown,19.4285,95.2534,Thayet,Thayet,Thayet,MM
Shwe Padauk Filling Station,,19.32,95.21,Near Thayet Myoma Market,Thayet,Thayet,MM
Thein Than Filling Station,,19.33,95.2,Thayet-Aunglan Road,Thayet,Thayet,MM
Shwe Pyi Tan Filling Station,,19.63,95.08,Mindon,Mindon,Thayet,MM
Khin Maung Tint Filling Station,,19.3,95.23,Kamma,Kamma,Thayet,MM
Myo Set Set Filling Station,,19.31,95.22,Kamma,Kamma,Thayet,MM
Unknown Filling Station,,19.6,95,Sinbaungwe,Sinbaungwe,Thayet,MM
Unknown Filling Station,,19.55,94.95,Sinbaungwe,Sinbaungwe,Thayet,MM
Min Hla Yadanar Filling Station,,19.75,95.15,Minhla,Minhla,Thayet,MM
Shwe Pyi Tan Filling Station,,19.73,95.14,Minhla,Minhla,Thayet,MM
Minhla Filling Station,MPE,19.664,95.164,Main Road,Minhla,Minhla,MM
Minhla Petrol Station,Shwe Taung,19.668,95.16,Near Market,Minhla,Minhla,MM
Gas Station Minhla,,19.66,95.168,Highway,Minhla,Minhla,MM
Aye Yarwady Fuel Station,Unknown,19.2987,95.3541,"Minhla, Magway Region",Minhla,Minhla,MM
Shwe Padauk Fuel Station,Unknown,19.3012,95.3508,"Minhla, Near the Market",Minhla,Minhla,MM
Mya Nan Taw Fuel Stop,Unknown,19.3005,95.3555,"Highway Road, Minhla",Minhla,Minhla,MM
Pyi Thar Yar Station,Unknown,19.295,95.348,Minhla Township,Minhla,Minhla,MM
Yadanar Fuel Depot,Unknown,19.305,95.36,Outskirts of Minhla,Minhla,Minhla,MM
Win Star Gas Station,Unknown,19.2995,95.352,"Near the Main Road, Minhla",Minhla,Minhla,MM
New Millennium Fuel,Unknown,19.2977,95.3562,Minhla Central,Minhla,Minhla,MM
Zeya Phyo Fuel,Unknown,19.3025,95.3495,Minhla Area,Minhla,Minhla,MM
Aung Thapyay Fuel Station,Unknown,19.2965,95.3535,"Near the River, Minhla",Minhla,Minhla,MM
Bo Bo Aung Fuel Station,Unknown,19.304,95.3585,"Highway Access, Minhla",Minhla,Minhla,MM
Shwe Taung Tan Fuel Stop,Unknown,19.299,95.347,Rural Minhla,Minhla,Minhla,MM
Thazin Fuel Service,Unknown,19.298,95.355,Minhla Centre,Minhla,Minhla,MM
Yoma 3 Fuel Station,Yoma,19.303,95.357,Minhla Main Road,Minhla,Minhla,MM
MPE Filling Station,MPE,21.337,95.091,Near Pakokku University,Pakokku,Pakokku,MM
Shwe Taung Filling Station,Shwe Taung,21.349,95.11,Yangon-Pakokku Road,Pakokku,Pakokku,MM
YBS Filling Station,,21.343,95.103,Pakokku-Myaing Road,Pakokku,Pakokku,MM
Total Filling Station,Total,21.355,95.118,Near Pakokku Airport,Pakokku,Pakokku,MM
Aung Yadanar Fuel Station,,21.638,94.781,Yesagyo-Pakokku Road,Yesagyo,Pakokku,MM
Shwe Padauk Fuel Station,,21.634,94.785,Yesagyo-Pakokku Road,Yesagyo,Pakokku,MM
Hein Min Fuel Station,,21.64,94.779,Yesagyo-Pakokku Road,Yesagyo,Pakokku,MM
Pauk Min Thandar Filling Station,,21.612,94.525,Pauk-Kyaukhtu Road,Pauk,Pakokku,MM
Shwe Padauk Oil Station,,21.606,94.531,Pauk-Kyaukhtu Road,Pauk,Pakokku,MM
Aung Myint Mo Petrol Station,,20.9125,94.5833,Seikphyu-Yesagyo Road,Seikphyu,Pakokku,MM
Min Thar Gyi Petrol Station,,20.9083,94.575,Seikphyu,Seikphyu,Pakokku,MM
Myo Setkya Petrol Station,,20.8667,94.5833,Seikphyu,Seikphyu,Pakokku,MM
Aung Myin Thar Petrol Station,,21.414,94.635,Myaing-Pakokku Road,Myaing,Pakokku,MM
Min Thar Gyi Petrol Station,,21.416,94.637,Myaing-Pakokku Road,Myaing,Pakokku,MM
Shwe Nant Thar Fuel Station,Unknown,21.3397,95.1042,"Pakokku, Myanmar",Pakokku,Pakokku,MM
Win Star Fuel Station,Unknown,21.3356,95.0987,"Pakokku, Myanmar",Pakokku,Pakokku,MM
Aye Chan Thar Fuel Station,Unknown,21.3412,95.1111,"Pakokku, Myanmar",Pakokku,Pakokku,MM
Shwe Pyi Thar Fuel Station,Unknown,21.3289,95.1005,"Pakokku, Myanmar",Pakokku,Pakokku,MM
Aung Takon Fuel Station,Unknown,21.3322,95.1078,"Pakokku, Myanmar",Pakokku,Pakokku,MM
Myitta Yaung Chi Fuel Station,Unknown,21.3375,95.115,"Pakokku, Myanmar",Pakokku,Pakokku,MM
Shwe Hintha Fuel Station,Unknown,21.325,95.095,"Pakokku, Myanmar",Pakokku,Pakokku,MM
Emerald Green Fuel Station,Unknown,21.345,95.1,"Pakokku, Myanmar",Pakokku,Pakokku,MM
New Light Fuel Station,Unknown,21.33,95.11,"Pakokku, Myanmar",Pakokku,Pakokku,MM
Golden Arrow Fuel Station,Unknown,21.32,95.09,"Pakokku, Myanmar",Pakokku,Pakokku,MM
Maha Bandoola Fuel Station,Unknown,21.35,95.115,"Pakokku, Myanmar",Pakokku,Pakokku,MM
Pinlon Fuel Station,Unknown,21.3425,95.105,"Pakokku, Myanmar",Pakokku,Pakokku,MM
Yadana Bone Fuel Station,Unknown,21.3375,95.0975,"Pakokku, Myanmar",Pakokku,Pakokku,MM
Thitsar Fuel Station,Unknown,21.3225,95.1025,"Pakokku, Myanmar",Pakokku,Pakokku,MM
Myo Ma Fuel Station,Unknown,21.3475,95.1125,"Pakokku, Myanmar",Pakokku,Pakokku,MM
Kyaw Zaya Fuel Station,Unknown,21.335,95.1,"Pakokku, Myanmar",Pakokku,Pakokku,MM
Power Fuel Station,Unknown,21.34,95.105,"Pakokku, Myanmar",Pakokku,Pakokku,MM
Aung Myin Thar Fuel Station,Unknown,22.345,94.21,Gangaw-Htilin Road,Gangaw,Gangaw,MM
Yadanar Fuel Station,Unknown,22.34,94.2,Gangaw-Htilin Road,Gangaw,Gangaw,MM
Unknown Fuel Station,,22.161,94.011,Near Tilin-Htilin Road Junction,Tilin,Gangaw,MM
Unknown Fuel Station,,22.158,94.012,Tilin,Tilin,Gangaw,MM
Saw Petrol Station,MPE,22.008,94.085,"Main Road, Saw",Saw,Gangaw,MM
Shwe Taung Filling Station,Shwe Taung,22.015,94.092,Near Saw Market,Saw,Gangaw,MM
Htilin Fuel Station,Unknown,22.018,94.086,Htilin-Gangaw Road,Htilin,Gangaw,MM
MPE Htilin,MPE,22.015,94.083,Near Htilin Market,Htilin,Gangaw,MM
Htilin Petrol Station,Unknown,22.02,94.089,Main Road,Htilin,Gangaw,MM
Gangaw Petrol Station,Unknown,22.0667,94.0833,"Gangaw, Myanmar",Gangaw,Gangaw,MM
Min Thar Fuel Station,Unknown,22.1,94.1,"Near Gangaw Market, Gangaw",Gangaw,Gangaw,MM
Shwe Pyi Tan Fuel Station,Unknown,22.05,94.07,"On the way to Htilin, Gangaw",Gangaw,Gangaw,MM
Aung Zeya Fuel Station,Unknown,22.08,94.09,"Near Gangaw University, Gangaw",Gangaw,Gangaw,MM
Myoma Fuel Station,Unknown,22.07,94.08,"Myoma Quarter, Gangaw",Gangaw,Gangaw,MM
Pin Chaung Fuel Station,Unknown,22.09,94.06,"Near Pin Chaung Bridge, Gangaw",Gangaw,Gangaw,MM
Kyauk Htut Fuel Station,Unknown,22.11,94.05,"Kyauk Htut Village, Gangaw",Gangaw,Gangaw,MM
Bo Gyoke Fuel Station,Unknown,22.06,94.1,"Bo Gyoke Road, Gangaw",Gangaw,Gangaw,MM
Nawarat Fuel Station,Unknown,22.04,94.09,"Nawarat Quarter, Gangaw",Gangaw,Gangaw,MM
Thanlyin Fuel Station,Unknown,22.085,94.075,"Thanlyin Village, Gangaw",Gangaw,Gangaw,MM
Nyaung Kone Fuel Station,Unknown,22.075,94.095,"Nyaung Kone Village, Gangaw",Gangaw,Gangaw,MM
Mya Yadanar Fuel Station,Unknown,22.055,94.085,"Between Gangaw and Htilin, Gangaw",Gangaw,Gangaw,MM
MPE Filling Station,MPE,22.02,96.47,Near Pyin Oo Lwin-Lashio Road,Pyin Oo Lwin,Pyin Oo Lwin,MM
Shwe Taung Petrol Station,Shwe Taung,22.01,96.47,Pyin Oo Lwin-Lashio Road,Pyin Oo Lwin,Pyin Oo Lwin,MM
CNPC Filling Station,CNPC,22,96.46,Near National Kandawgyi Botanical Gardens,Pyin Oo Lwin,Pyin Oo Lwin,MM
MPT Filling Station,MPT,22.03,96.48,Close to Pyin Oo Lwin city center,Pyin Oo Lwin,Pyin Oo Lwin,MM
Pin Lon Filling Station,,21.99,96.45,Near Pyin Oo Lwin Market,Pyin Oo Lwin,Pyin Oo Lwin,MM
Mogok Yadanar Filling Station,Unknown,22.929,96.526,"Main Road, Mogok",Mogok,Pyin Oo Lwin,MM
Shwe Taung Petrol Station,Shwe Taung,22.928,96.524,Mogok,Mogok,Pyin Oo Lwin,MM
MPE Filling Station,MPE,22.926,96.529,Mogok,Mogok,Pyin Oo Lwin,MM
Shwe Padauk Filling Station,Shwe Taung,22.668,96.065,Mandalay - Mogok Road,Thabeikkyin,Pyin Oo Lwin,MM
MPE Filling Station,MPE,22.665,96.06,Mandalay - Mogok Road,Thabeikkyin,Pyin Oo Lwin,MM
Yadanarbon Oil,,22.707,96.079,Mandalay - Mogok Road,Thabeikkyin,Pyin Oo Lwin,MM
Shwe Taung Gas Station,Shwe Taung,22.133,96.153,Sintgaing-Madaya Road,Sintgaing,Pyin Oo Lwin,MM
MPE Gas Station,MPE,22.14,96.15,Near Sintgaing town entrance,Sintgaing,Pyin Oo Lwin,MM
Aung Myin Mo Filling Station,,22.0475,96.4732,Near Pyin Oo Lwin - Mandalay Road,Pyin Oo Lwin,Pyin Oo Lwin,MM
Kyaukse Gyi Filling Station,,22.035,96.468,Pyin Oo Lwin - Mandalay Road,Pyin Oo Lwin,Pyin Oo Lwin,MM
Nann Htike Filling Station,,22.039,96.4705,Near Pyin Oo Lwin - Mandalay Road,Pyin Oo Lwin,Pyin Oo Lwin,MM
Shwe Nan Taw Filling Station,,22.0285,96.4655,Close to Pyin Oo Lwin - Mandalay Road,Pyin Oo Lwin,Pyin Oo Lwin,MM
Aye Mya Thazin Filling Station,,22.042,96.4715,Near the Highway,Pyin Oo Lwin,Pyin Oo Lwin,MM
Paing Soe Thu Filling Station,,22.049,96.474,Close to main road,Pyin Oo Lwin,Pyin Oo Lwin,MM
Yadanar Maung Filling Station,,22.037,96.4695,Pyin Oo Lwin Area,Pyin Oo Lwin,Pyin Oo Lwin,MM
Win Yadanar Filling Station,,22.0295,96.466,Close to exit of city,Pyin Oo Lwin,Pyin Oo Lwin,MM
Myat Mandalar Filling Station,,22.036,96.469,Near highway exit,Pyin Oo Lwin,Pyin Oo Lwin,MM
Shwe Pyi Tan Filling Station,,22.04,96.471,Pyin Oo Lwin main thoroughfare,Pyin Oo Lwin,Pyin Oo Lwin,MM
Zawana Filling Station,,22.0385,96.47,On the main road,Pyin Oo Lwin,Pyin Oo Lwin,MM
New Generation Filling Station,,22.0465,96.4725,Close to highway,Pyin Oo Lwin,Pyin Oo Lwin,MM
Phyu Sin Filling Station,,22.0395,96.4707,On the main route,Pyin Oo Lwin,Pyin Oo Lwin,MM
Shwe Hintha Filling Station,,22.0485,96.4737,Close proximity to highway,Pyin Oo Lwin,Pyin Oo Lwin,MM
Yadanar Pwint Filling Station,,22.0375,96.4697,On main thoroughfare,Pyin Oo Lwin,Pyin Oo Lwin,MM
Myat Thu Kha Filling Station,,22.0455,96.4722,Near Highway,Pyin Oo Lwin,Pyin Oo Lwin,MM
Aung Thitsar Filling Station,,22.0325,96.4675,Close to the city exit,Pyin Oo Lwin,Pyin Oo Lwin,MM
MPE Kyaukse Branch,MPE,21.615,96.128,"Yangon-Mandalay Old Road, near Kyaukse University",Kyaukse,Kyaukse,MM
Shwe Taung Kyaukse,Shwe Taung,21.61,96.125,Yangon-Mandalay Old Road,Kyaukse,Kyaukse,MM
PTT Kyaukse,PTT,21.595,96.135,Near Kyaukse Myoma Market,Kyaukse,Kyaukse,MM
Myittha Filling Station,MPE,21.33,96.21,Myittha-Kyaukse Road,Myittha,Kyaukse,MM
Shwe Taung Myittha,Shwe Taung,21.34,96.22,Near Myittha Town,Myittha,Kyaukse,MM
Kyaukse YBS Filling Station,YBS,21.697,96.126,Yangon-Mandalay Old Rd,Tada-U,Kyaukse,MM
Aung Myin Filling Station,Unknown,21.612,96.125,Kyaukse,Kyaukse,Kyaukse,MM
Shwe Sin Filling Station,Unknown,21.598,96.132,Kyaukse,Kyaukse,Kyaukse,MM
Min Tar Gyi Filling Station,Unknown,21.605,96.129,Kyaukse,Kyaukse,Kyaukse,MM
Yadanar Theingi Filling Station,Unknown,21.618,96.121,Kyaukse,Kyaukse,Kyaukse,MM
Shwe Pyi Thar Filling Station,Unknown,21.588,96.135,Kyaukse,Kyaukse,Kyaukse,MM
Win Star Filling Station,Unknown,21.602,96.127,Kyaukse,Kyaukse,Kyaukse,MM
Myint Mo Filling Station,Unknown,21.595,96.138,Kyaukse,Kyaukse,Kyaukse,MM
Aung Gabar Filling Station,Unknown,21.615,96.123,Kyaukse,Kyaukse,Kyaukse,MM
Shwe Padauk Filling Station,Unknown,21.591,96.131,Kyaukse,Kyaukse,Kyaukse,MM
Yee Htat Filling Station,Unknown,21.608,96.126,Kyaukse,Kyaukse,Kyaukse,MM
Shwe Nan Taw Filling Station,Unknown,21.5945,96.1305,Kyaukse,Kyaukse,Kyaukse,MM
Obo Filling Station,Unknown,21.6015,96.1285,Kyaukse,Kyaukse,Kyaukse,MM
Zayar Lin Filling Station,Unknown,21.61,96.124,Kyaukse,Kyaukse,Kyaukse,MM
U Chit Filling Station,Unknown,21.5875,96.1335,Kyaukse,Kyaukse,Kyaukse,MM
New Light Filling Station,Unknown,21.607,96.122,Kyaukse,Kyaukse,Kyaukse,MM
Tun Brothers Filling Station,Unknown,21.59,96.129,Kyaukse,Kyaukse,Kyaukse,MM
Paradise Filling Station,Unknown,21.613,96.136,Kyaukse,Kyaukse,Kyaukse,MM
Zawana Filling Station,Unknown,21.596,96.139,Kyaukse,Kyaukse,Kyaukse,MM
Pann Myo Thu Filling Station,Unknown,21.609,96.142,Kyaukse,Kyaukse,Kyaukse,MM
MPE Myingyan (1),MPE,21.467,95.388,Yangon-Mandalay Rd,Myingyan,Myingyan,MM
Shwe Taung Myingyan,Shwe Taung,21.464,95.391,Yangon-Mandalay Rd,Myingyan,Myingyan,MM
CNPC Myingyan,CNPC,21.468,95.386,Yangon-Mandalay Rd,Myingyan,Myingyan,MM
PTT Myingyan,PTT,21.466,95.389,Yangon-Mandalay Rd,Myingyan,Myingyan,MM
U Ko Ko Filling Station,,21.243,95.681,Natogyi-Myingyan Road,Natogyi,Myingyan,MM
Shwe Taung Station,Shwe Taung,21.225,95.675,Near Natogyi,Natogyi,Myingyan,MM
Unknown Filling Station,,21.235,95.68,Natogyi-Myingyan Road,Natogyi,Myingyan,MM
Taungtha Yadanar Fuel Station,,21.168,95.135,Taungtha-Myingyan Road,Taungtha,Myingyan,MM
Shwe Than Lwin Fuel Station,,21.171,95.134,Taungtha,Taungtha,Myingyan,MM
Aung Myin Filling Station,Unknown,21.4657,95.3842,"Myingyan-Nyaung U Road, Myingyan",Myingyan,Myingyan,MM
Yadanarbon Fuel Station,Unknown,21.4712,95.3895,"Near Myingyan University, Myingyan",Myingyan,Myingyan,MM
Min Thandar Filling Station,Unknown,21.4589,95.3761,"Myingyan-Meiktila Road, Myingyan",Myingyan,Myingyan,MM
Myoma Fuel Station,Unknown,21.4523,95.3698,"Myoma Market Area, Myingyan",Myingyan,Myingyan,MM
Shwe Pauk Kan Filling Station,Unknown,21.4821,95.3954,"Shwe Pauk Kan Village, Myingyan",Myingyan,Myingyan,MM
Kyaw Zeya Filling Station,Unknown,21.4465,95.3632,"Near Railway Station, Myingyan",Myingyan,Myingyan,MM
Nge Lay Filling Station,Unknown,21.4601,95.3799,"Near Industrial Zone, Myingyan",Myingyan,Myingyan,MM
U Ba Swe Filling Station,Unknown,21.4774,95.3911,"On the way to Natogyi, Myingyan",Myingyan,Myingyan,MM
Shwe Nan Taw Filling Station,Unknown,21.4555,95.3733,"Near Shwe Nan Taw Pagoda, Myingyan",Myingyan,Myingyan,MM
Aung Takon Filling Station,Unknown,21.4688,95.3866,"Aung Takon Quarter, Myingyan",Myingyan,Myingyan,MM
Shwe Kabar Filling Station,Unknown,21.4491,95.3664,"Near Kabar Aye Pagoda, Myingyan",Myingyan,Myingyan,MM
Yan Gyi Aung Filling Station,Unknown,21.4735,95.3884,"Near Yan Gyi Aung Village, Myingyan",Myingyan,Myingyan,MM
Min Shin Filling Station,Unknown,21.4624,95.3817,"Near Min Shin Monastery, Myingyan",Myingyan,Myingyan,MM
Lay Thar Gone Filling Station,Unknown,21.4568,95.3748,"Lay Thar Gone Quarter, Myingyan",Myingyan,Myingyan,MM
Aung Zabu Filling Station,Unknown,21.4797,95.3935,"Aung Zabu Village, Myingyan",Myingyan,Myingyan,MM
Myingyan South Filling Station,Unknown,21.4432,95.3601,"Southern Part of Myingyan, Myingyan",Myingyan,Myingyan,MM
MPE Filling Station,MPE,21.18,94.92,Near Nyaung U Airport,Nyaung-U,Nyaung-U,MM
Shwe Taung Filling Station,Shwe Taung,21.17,94.91,"Main Road, Nyaung-U",Nyaung-U,Nyaung-U,MM
CNPC Filling Station,CNPC,21.18,94.93,Near Nyaung U,Nyaung-U,Nyaung-U,MM
Mya Yadana Petrol Station,,20.815,95.08,Kyaukpadaung-Natogyi Road,Kyaukpadaung,Nyaung-U,MM
Shwe Taung Petrol Station,Shwe Taung,20.81,95.07,Near Kyaukpadaung Hospital,Kyaukpadaung,Nyaung-U,MM
MPE Petrol Station,MPE,20.79,95.06,"Main Road, Kyaukpadaung",Kyaukpadaung,Nyaung-U,MM
MPE Filling Station,MPE,21.17,94.87,Near Nyaung-U Airport,Bagan,Nyaung-U,MM
Shwe Taung Filling Station,Shwe Taung,21.18,94.88,"Main Road, Nyaung-U",Bagan,Nyaung-U,MM
CNPC Filling Station,CNPC,21.16,94.86,Near Nyaung-U Junction,Bagan,Nyaung-U,MM
PTT Filling Station,PTT,21.19,94.89,Nyaung-U Bypass Road,Bagan,Nyaung-U,MM
Filling Station (Unnamed),,21.15,94.85,Near Wetkyi-in Village,Bagan,Nyaung-U,MM
Aung Myin Filling Station,Unknown,21.1833,94.925,"Nyaung-U, Myanmar",Nyaung-U,Nyaung-U,MM
Min Thar Gyi Filling Station,Unknown,21.179,94.931,"Near Nyaung-U Airport, Nyaung-U",Nyaung-U,Nyaung-U,MM
Shwe Pyi Tan Filling Station,Unknown,21.1655,94.9188,Nyaung-U Township,Nyaung-U,Nyaung-U,MM
Kyaw Zaya Filling Station,Unknown,21.1812,94.9287,"Nyaung-U, Myanmar",Nyaung-U,Nyaung-U,MM
Lin Thar Oo Filling Station,Unknown,21.19,94.935,"Nyaung-U, Myanmar",Nyaung-U,Nyaung-U,MM
Yadanarpon Filling Station,Unknown,21.175,94.922,"Nyaung-U, Myanmar",Nyaung-U,Nyaung-U,MM
Aung Gabar Filling Station,Unknown,21.1853,94.9301,"Nyaung-U, Myanmar",Nyaung-U,Nyaung-U,MM
Shwe Lamin Filling Station,Unknown,21.1777,94.9244,"Nyaung-U, Myanmar",Nyaung-U,Nyaung-U,MM
Myitta Yaung Chi Filling Station,Unknown,21.1695,94.92,Nyaung-U Township,Nyaung-U,Nyaung-U,MM
Phyo Thiri Filling Station,Unknown,21.187,94.932,"Nyaung-U, Myanmar",Nyaung-U,Nyaung-U,MM
Moe Thu Ka Filling Station,Unknown,21.173,94.926,"Nyaung-U, Myanmar",Nyaung-U,Nyaung-U,MM
Aung Zeya Filling Station,Unknown,21.189,94.934,"Nyaung-U, Myanmar",Nyaung-U,Nyaung-U,MM
Yadanar Sein Filling Station,Unknown,21.181,94.927,"Nyaung-U, Myanmar",Nyaung-U,Nyaung-U,MM
Shwe Nan Taw Filling Station,Unknown,21.176,94.923,"Nyaung-U, Myanmar",Nyaung-U,Nyaung-U,MM
May Thu Kha Filling Station,Unknown,21.17,94.919,Nyaung-U Township,Nyaung-U,Nyaung-U,MM
Aung Thitsar Filling Station,Unknown,21.184,94.929,"Nyaung-U, Myanmar",Nyaung-U,Nyaung-U,MM
Shwe Pauk Kan Filling Station,Unknown,21.178,94.925,"Nyaung-U, Myanmar",Nyaung-U,Nyaung-U,MM
Min Tayar Filling Station,Unknown,21.171,94.921,Nyaung-U Township,Nyaung-U,Nyaung-U,MM
Maha Aung Myay Filling Station,Unknown,21.191,94.936,"Nyaung-U, Myanmar",Nyaung-U,Nyaung-U,MM
Yamethin MPE Station,MPE,19.72,96.32,Yangon-Mandalay Road,Yamethin,Yamethin,MM
Shwe Taung Yamethin,Shwe Taung,19.7,96.3,Near Yamethin Town,Yamethin,Yamethin,MM
Aung Myint Mo Fuel Station,Private,19.7458,96.3125,"Near Yamethin Hospital, Yamethin",Yamethin,Yamethin,MM
Myoma Fuel Station,Private,19.7392,96.3078,"Myoma Quarter, Yamethin",Yamethin,Yamethin,MM
Yadanarbon Fuel Station,Private,19.7511,96.3189,"Pyi Taw Thar Ward, Yamethin",Yamethin,Yamethin,MM
Shwe Phee Oo Fuel Station,Private,19.7433,96.3211,"Beside the Yangon-Mandalay Highway, Yamethin",Yamethin,Yamethin,MM
Min Tayar Fuel Station,Private,19.7366,96.3045,"Near the Yamethin Market, Yamethin",Yamethin,Yamethin,MM
Aung Thitsar Fuel Station,Private,19.7543,96.3256,"North of the town center, Yamethin",Yamethin,Yamethin,MM
Nawarat Fuel Station,Private,19.7321,96.2998,"Southern part of Yamethin, near the railway",Yamethin,Yamethin,MM
Shwe Oak Fuel Station,Private,19.7477,96.3155,"Central Yamethin, near the main road",Yamethin,Yamethin,MM
Golden City Fuel Station,Private,19.741,96.309,"In the heart of Yamethin, near the clock tower",Yamethin,Yamethin,MM
New Generation Fuel Station,Private,19.7565,96.3278,"On the outskirts of Yamethin, towards Pyawbwe",Yamethin,Yamethin,MM
Myat Mandalar Fuel Station,Private,19.7344,96.3022,"Close to the bus station, Yamethin",Yamethin,Yamethin,MM
Kyaw Zeya Fuel Station,Private,19.7499,96.3177,"Near the district office, Yamethin",Yamethin,Yamethin,MM
Shwe Pyi Tan Fuel Station,Private,19.7587,96.329,"On the road to Tatkon, Yamethin",Yamethin,Yamethin,MM
Myo Ma Zay Fuel Station,Private,19.73,96.298,"South of Myoma Market, Yamethin",Yamethin,Yamethin,MM
Yaung Chi Oo Fuel Station,Private,19.7444,96.3133,"Near the main roundabout, Yamethin",Yamethin,Yamethin,MM
Htoo Zaw Fuel Station,Private,19.7522,96.32,"North of Yamethin, closer to the Highway",Yamethin,Yamethin,MM
Sein Lei Fuel Station,Private,19.7377,96.3055,"Close to the police station, Yamethin",Yamethin,Yamethin,MM
Myat Thu Kha Fuel Station,Private,19.76,96.33,"On the road to the North, Yamethin",Yamethin,Yamethin,MM
MPE Filling Station,MPE,20.87,95.87,Yangon-Mandalay Road,Meiktila,Meiktila,MM
Shwe Taung Filling Station,Shwe Taung,20.87,95.88,Yangon-Mandalay Road,Meiktila,Meiktila,MM
PTT Filling Station,PTT,20.86,95.86,Near Meiktila Airport,Meiktila,Meiktila,MM
CNPC Filling Station,CNPC,20.88,95.89,Yangon-Mandalay Road,Meiktila,Meiktila,MM
Golden Petrol Station,Golden Star,20.824,95.684,Yangon-Mandalay Rd,Mahlaing,Meiktila,MM
Shwe Taung Petrol Station,Shwe Taung,20.815,95.688,Yangon-Mandalay Rd,Mahlaing,Meiktila,MM
Aung Yadanar Filling Station,,20.574,96.053,Yangon-Mandalay Road,Thazi,Meiktila,MM
Zawana Filling Station,,20.579,96.055,Yangon-Mandalay Road,Thazi,Meiktila,MM
MPE Filling Station,MPE,20.576,96.054,Yangon-Mandalay Road,Thazi,Meiktila,MM
Aung Myint Mo Filling Station,,20.8328,95.9311,Yangon-Mandalay Old Highway,Wundwin,Meiktila,MM
Shwe Padauk Filling Station,,20.8336,95.9322,Yangon-Mandalay Old Highway,Wundwin,Meiktila,MM
Min Sithu Filling Station,,20.8377,95.9348,Yangon-Mandalay Old Highway,Wundwin,Meiktila,MM
Yadanar Maung Filling Station,,20.8754,95.8702,Near Meiktila Airport,Meiktila,Meiktila,MM
Kyaw Zaya Filling Station,,20.8821,95.8815,Yangon-Mandalay Expressway,Meiktila,Meiktila,MM
Myoma Filling Station,,20.879,95.8755,Myoma Market Area,Meiktila,Meiktila,MM
Paing Ko Filling Station,,20.8772,95.873,Near Railway Station,Meiktila,Meiktila,MM
Hein Thu Filling Station,,20.8699,95.8687,Highway Road,Meiktila,Meiktila,MM
Shwe Pyi Tan Filling Station,,20.8735,95.8695,North of the City,Meiktila,Meiktila,MM
Min Teza Filling Station,,20.8703,95.8718,On the main road,Meiktila,Meiktila,MM
Myat Thandar Filling Station,,20.867,95.875,Near the hospital,Meiktila,Meiktila,MM
Aung Hein Filling Station,,20.8715,95.876,On the outskirts of town,Meiktila,Meiktila,MM
Nawarat Filling Station,,20.8728,95.8785,In the industrial area,Meiktila,Meiktila,MM
Shwe Nan Taw Filling Station,,20.8655,95.865,Close to the lake,Meiktila,Meiktila,MM
Yadanar Thike Filling Station,,20.8695,95.8735,Highway entrance,Meiktila,Meiktila,MM
Myo Setkya Filling Station,,20.8765,95.8775,Near bus terminal,Meiktila,Meiktila,MM
Shin Mahar Filling Station,,20.871,95.869,Downtown,Meiktila,Meiktila,MM
Kyaw Myanmar Filling Station,,20.8745,95.8725,Residential Area,Meiktila,Meiktila,MM
